latitude,longitude,location,newlocation
42.24107573,-2.366248561,2288,"Camino a Santa Marina, 26132 Santa Engracia del Jubera, Spain"
-20.98473249,55.29309947,2289,"36 Rue Kovil, 97460 SaintPaul, France"
-29.30307287,-50.33878437,2290,"Rodovia Teixeirinha, Sede Distrital de Tainhas, Sao Francisco de Paula  RS, Brazil"
46.05287057,26.7380983,2291,"Mos Ion Roata, 627062 Gura Vaii, Romania"
-32.12124074,141.8207449,2292,"Menindee Road, Broken Hill NSW, Australia"
11.75747055,12.22736854,2293,"KanoMaiduguri Highway, Ngamdu, Borno State, Nigeria"
-24.08656004,-52.66114005,2294,"BR272, Martinopolis DOeste, Regiao Geografica Intermediaria de Maringa  PR, 87317000, Brazil"
41.99803649,33.53529068,2295,"D010, Doganyurt, Turkey"
23.58403683,-99.24110062,2296,"Libramiento Ciudad Victoria, La Joya, TAM, Mexico"
35.314464,139.9464736,2297,"unnamed road, Kimitsu, Chiba Prefecture 2991172, Japan"
47.67876997,40.98624989,2298,"Shakhty  Tsimlyansk, Rostov Oblast, Russia"
63.07544149,113.5200487,2299,"unnamed road, Sakha Republic, Russia"
-21.07021776,-63.38955028,2300,"RN9 VillamontesBoyuibe, Villa Montes, Bolivia"
-17.18019815,-62.56218308,178,"RN9 Los TroncosCuatro Canadas, Municipio Cuatro Canadas, Bolivia"
-23.42830879,-51.80544932,2301,"Estrada Uvarana, Jardim Aurora IV, Sarandi  PR, 87114636, Brazil"
-32.01098951,122.8015153,80,"Eyre Highway, Fraser Range WA, Australia"
41.57563263,26.54484427,2302,"unnamed road, Nea Vyssa, Greece"
15.56559181,-91.85348294,2303,"Carretera Panamericana, Camoja, Guatemala"
16.5612009,102.8415198,2304,"Ban Nong Kha, unnamed road, Khon Kaen Province, Thailand"
-18.08082486,-70.19627587,2305,"unnamed road, Coronel Gregorio Albarracin Lanchipa, Peru"
-36.10655233,-59.92139346,2306,"El Destino, Ruta Provincial 51, Partido de General Alvear, Buenos Aires, Argentina"
3.754548945,-73.15527295,2307,"unnamed road, Puerto Lopez, MET, Colombia"
1.361419462,-76.51682633,2308,"Via Mocoa  Pitalito, Santa Rosa, CAU, Colombia"
48.39484186,17.43928822,2309,"1293, 919 02 Dlha, Slovakia"
57.49936981,80.8468379,2310,"Kedrovy  Kyonga, Tomsk Oblast, Russia"
49.51133129,95.26034877,2311,"Zuunkhangai, Mongolia"
25.88096013,-99.90977845,2312,"San Roberto, A Miguel Aleman, Doctor Gonzalez, NLE, Mexico"
-17.85337974,139.3754332,2313,"Wills Developmental Road, Nicholson QLD, Australia"
-28.12464664,16.89144069,2314,"unnamed road, Richtersveld Ward 1, Richtersveld Local Municipality, South Africa"
15.48241275,-12.96981592,2315,"R090, Thiemping, Senegal"
-25.33928211,142.3911224,2033,"Diamantina Developmental Road, Windorah QLD, Australia"
68.24848406,25.84483478,435,"Inarintie, Kittila, Finland"
-36.83529587,-59.57508648,2316,"La Isabelita, Ruta Provincial 60, Partido de Azul, Buenos Aires, Argentina"
-34.16492249,146.877675,2317,"Kittos Lane, Ardlethan NSW, Australia"
-22.02226586,-50.78200248,2318,"Rodovia Brigadeiro Eduardo Gomes, Rancharia, Rancharia  SP, Brazil"
8.659780837,10.79642626,2319,"A4, Mutum Biyu, Taraba State, Nigeria"
39.03221057,34.58570599,2320,"KayseriKirikkale yolu, Mucur, Turkey"
65.65527286,-19.58141611,2321,"Saudarkroksbraut, Skagafjordur, Iceland"
-6.964457576,-37.14266168,2322,"unnamed road, Sao Mamede, Regiao Geografica Intermediaria de Patos  PB, Brazil"
-37.90636041,-63.70091843,2323,"Ruta Nacional 35 Doctor Rene Favaloro, Departamento Hucal, La Pampa, Argentina"
-22.70821861,27.05669351,2324,"A1, Botswana"
-1.849983444,38.21265776,2325,"D506, Kitui County, Kenya"
45.37504211,114.3830431,2326,"Shiliin Bogd, Mongolia"
51.67164157,108.4130561,2327,"Podezd k s Chelutai, Tatarskii Kliuch, Buryatia, Russia"
-23.14354095,21.03914792,581,"unnamed road, Botswana"
52.23110143,60.70585316,2328,"75K426, Atamanovskiy, Chelyabinsk Oblast, Russia"
12.68635546,-14.93854548,427,"unnamed road, Tonhataba, GuineaBissau"
-16.73791204,135.1268334,889,"Carpentaria Highway, Mcarthur NT, Australia"
-32.89453101,27.65949877,2329,"N2, Buffalo City Ward 26, Eastern Cape, South Africa"
-17.86452659,-51.56634167,2330,"BR060, Jatai  GO, Brazil"
22.97389741,-99.61541129,2331,"Carretera TulaOcampoEl Limon, Ciudad Tula, TAM, Mexico"
13.26038937,75.72200992,2332,"unnamed road, Chikkamagaluru, Valagerehalli  577174, Karnataka, India"
63.50850478,22.74852322,2333,"Markbyvagen, Nykarleby, Finland"
-6.909149233,-76.57206536,2334,"Carretera a San Pablo, Consuelo, Peru"
-33.73246569,-60.4313582,2335,"Ruta Nacional 188, Partido de Pergamino, 2717 Guerrico, Argentina"
-18.66952089,-63.24122618,2336,"RN9 La GuardiaAbapo, Municipio Cabezas, Bolivia"
-9.868496426,-39.9939785,2337,"BA314, Pilar, Jaguarari  BA, Brazil"
21.13965385,-98.58545649,2338,"unnamed road, Orizatlan, HID, Mexico"
-29.55549472,-57.15921162,2339,"Ruta Nacional 14 Jose Gervasio Artigas, Departamento Paso de los Libres, Municipio de Paso de los Libres, Argentina"
-29.69034262,152.6804407,2340,"2631 Gwydir Highway, Ramornie NSW 2460, Australia"
-36.57057952,-69.82847965,2341,"Ruta Nacional 40, Departamento Malargue, Ranquil Norte, Argentina"
-5.955239164,-38.30302671,2342,"Rodovia Luiz Bezerra de Queiroz, Erere, Regiao Geografica Intermediaria de Quixada  CE, Brazil"
64.52838045,143.5286315,386,"Kolyma Highway, Sakha Republic, Russia"
51.02546261,33.73879703,2343,"R61, Konotop Raion, Holuby, Sumy Oblast, 41762, Ukraine"
-25.20773756,131.1770351,469,"Lasseter Highway, Petermann NT, Australia"
67.01881792,79.09449715,928,"unnamed road, YamaloNenets Autonomous Okrug, Russia"
44.72994364,27.44458872,2344,"DJ203F, 927211 Scanteia, Romania"
-29.98048465,-61.85449795,2345,"Ruta Nacional 34, Departamento San Cristobal, 2352 Municipio de Hersilia, Argentina"
47.46349528,118.7213378,1533,"Khalkhgol, Mongolia"
24.93973355,82.17840236,2346,"unnamed road, Prayagraj, Uttar Pradesh, India"
-46.68818129,-73.84925107,2347,"Aysen, Provincia de Aysen, Chile"
-17.58220885,-49.07752854,2348,"GO147, Morrinhos  GO, Brazil"
2.011150903,-61.47225014,2349,"Perimetral Norte, Iracema, Iracema  RR, Brazil"
-27.25395101,-62.11955539,2350,"La Nombrada, RP6, Departamento Moreno, Santiago del Estero, Argentina"
-30.46652274,20.49428319,2351,"R357, Hantam Ward 3, Hantam Local Municipality, 8915, South Africa"
47.68251345,116.4801552,2352,"Choibalsan  Khalkhgol, Mongolia"
66.25164957,68.58712601,2204,"71140R113, YamaloNenets Autonomous Okrug, Russia"
13.30553731,-11.64664553,1062,"R061, Missirah Sirimana, Senegal"
-27.63961141,151.2824312,2353,"Branchview Road, Condamine Plains QLD, Australia"
56.39087501,26.77243865,2354,"Vilani  Preili  Spogi, Kausa, LV5326, Latvia"
9.105612071,11.49134566,2355,"A4, Taraba State, Nigeria"
-23.33334667,-52.50672619,2356,"Rodovia Maria Nifa Garanhao, Porto Sao Carlos, Regiao Geografica Intermediaria de Maringa  PR, Brazil"
-16.24709869,168.1364469,2357,"Malampa, Vanuatu"
-10.75177868,-41.26904803,2358,"BA368, Vitoria, Ourolandia  BA, Brazil"
-1.276854893,36.61164499,2359,"ThogotoThigioLimuru Rd, Nachu ward, 00109, Kenya"
38.0260032,32.87486501,2360,"KonyaAksaray yolu, Karatay, Turkey"
19.34942986,99.27714539,2361,"Ban Khun Chae Lang, 1150, Chiang Mai Province, Thailand"
-23.99779445,24.02704074,2362,"A12, Dutlwe, Botswana"
-9.307501201,-39.07375692,2363,"Rodovia Santos Dumont, Caraibas, Chorrocho  BA, Brazil"
39.47760966,31.5934988,2364,"Ankara  Eskisehir Yolu, 26600 Sivrihisar, Turkey"
-26.57721976,133.2502832,1597,"Stuart Highway, De Rose Hill SA 0872, Australia"
30.77038512,35.75322155,2365,"60, Khirbat Abun, Jordan"
-32.68106656,-68.33884763,2366,"Ruta Nacional 142, Departamento Lavalle, Distrito Gustavo Andre, Argentina"
16.93498242,80.29027772,2367,"Chevitikallu  Vatsavai Road, NTR, Talluru  521402, Andhra Pradesh, India"
11.75429008,76.80851283,2368,"unnamed road, Chamarajanagar, Terakanambi  571123, Karnataka, India"
-33.74618712,-66.64040156,2369,"unnamed road, Juan Martin de Pueyrredon, Beazley, Argentina"
64.5317215,19.35698097,2370,"Fikengardsvagen, Amsele, Sweden"
7.997014105,79.94760392,2371,"unnamed road, Sri Lanka"
-13.58807561,-54.25059798,2372,"MT130, Santiago do Norte, Paranatinga  MT, Brazil"
47.22272845,18.465335,2373,"8000 Szekesfehervar, 811, Hungary"
23.99617975,81.3742343,2374,"SH57, Beohari, Shahdol, Madhya Pradesh, India"
57.38553797,74.70927002,2375,"Pologrudovo  Vasiss, Vasiss, Omsk Oblast, Russia"
3.995487158,33.76456818,2376,"Piobokoi  Kanangorok, Karenga, Uganda"
40.98308056,42.89708703,2377,"KarsArdahan yolu, Ardahan, Turkey"
63.07379726,113.5274892,2299,"unnamed road, Sakha Republic, Russia"
63.28249396,29.16018167,2378,"Sorveuksentie, Juuka, Finland"
-9.930230158,-45.33147366,2379,"BR135, Gilbues  PI, Brazil"
-22.9986964,134.3401074,2075,"Plenty Highway, Hart NT, Australia"
-19.78780645,142.9112955,2380,"Croydon Road, Saxby QLD, Australia"
-41.64803201,-65.62463677,2381,"Ruta Provincial 5, Departamento San Antonio, Sierra Grande, Argentina"
20.08839222,-104.4097803,2382,"Carretera Ayutla  San Miguel de la Sierra, Region Sierra Occidental, JAL, Mexico"
-26.59072411,144.4127376,1154,"Diamantina Developmental Road, Quilpie QLD, Australia"
-2.039800257,-47.63308436,2383,"Travessa Km Quarenta e Nove, Aurora do Para, Aurora do Para  PA, 68675000, Brazil"
-30.93240844,148.0156513,956,"Quambone Road, Quambone NSW 2829, Australia"
47.77765217,18.01296323,2384,"1462, 945 04 Komarno, Slovakia"
-33.80090754,121.7839967,2385,"167 Telegraph Road, Monjingup WA 6450, Australia"
-43.19624294,-66.03954733,2386,"Ruta Provincial 40, Departamento Gaiman, Chubut Province, Argentina"
-23.23479305,20.26241954,2387,"unnamed road, Ukhwi, Botswana"
-14.54911657,-52.8218244,2388,"MT110, Campinapolis  MT, 78630, Brazil"
-26.474863,147.9543366,2389,"unnamed road, Mitchell QLD 4465, Australia"
47.3987066,34.86594785,2390,"R37, Vasylivka Raion, Blahovishchenska rural hromada, Zaporizhia Oblast, 73767, Ukraine"
13.39092368,-11.6412023,1062,"R061, Missirah Sirimana, Senegal"
-11.51212651,-45.62601185,2391,"FP Lote 1, Anel da Soja, Caripare, Riachao das Neves  BA, Brazil"
54.4495086,113.5995467,2392,"unnamed road, Bagdarin, Buryatia, Russia"
-22.61505178,27.33641199,2393,"unnamed road, Malaka, Botswana"
42.92855625,75.01314889,2394,"Kyrgyzstan, Chuy Region, EM11"
40.20701633,40.99227064,2395,"D925, Aziziye, Turkey"
-16.0440459,-69.82403875,2396,"PU1237, Acora, Peru"
-9.646316863,-65.59988284,2397,"Estrada do Pacifico, Fortaleza do Abuna, Porto Velho  RO, Brazil"
26.35633071,73.66639085,2398,"unnamed road, JodhpurRural, Rajasthan, India"
-23.69254978,21.53525805,2399,"unnamed road, Monong, Botswana"
-18.22942902,-52.63672543,2400,"GO050, Chapadao do Ceu  GO, Brazil"
66.5219056,66.5891915,2401,"ulitsa Lenina, Salekhard, YamaloNenets Autonomous Okrug, Russia, 629000"
-22.21348534,-48.72629893,2402,"unnamed road, Itapui, Itapui  SP, 17230000, Brazil"
-27.7282496,-51.06130676,2403,"Rodovia Izidoro Marin, Anita Garibaldi, SC, Brazil"
-9.717466106,-62.90084982,2404,"unnamed road, Rio Crespo, Rio Crespo  RO, Brazil"
61.00252998,71.88047767,2405,"ulitsa Neftianikov, Promzona, Poikovskii, KhantyMansiysk Autonomous Okrug  Ugra, Russia, 628331"
8.78453281,3.6359596,2406,"unnamed road, Ogboro, Oyo State, Nigeria"
-29.37790973,-64.99938433,2407,"Ruta Nacional 157, Recreo, Municipio de Recreo, Argentina"
-26.19061447,150.0171789,2408,"Leichhardt Highway, Wandoan QLD, Australia"
-14.10727094,143.2133257,25,"Peninsula Developmental Road, Yarraden QLD, Australia"
-22.03007995,-57.20223671,2409,"MS384, Caracol, Regiao Geografica Intermediaria de Corumba  MS, Brazil"
-21.01970837,-43.34040004,2410,"MG280, Abreus, Alto Rio Doce  MG, Brazil"
-20.37334136,-55.85141635,2411,"MS170, Aquidauana, Aquidauana  MS, Brazil"
-9.559316176,-39.10421397,2412,"Rodovia Santos Dumont, Chorrocho  BA, Brazil"
-32.09112344,-55.75237193,1153,"Ruta 59, Tacuarembo, Uruguay"
-25.22367637,-59.82104426,2413,"Ruta Nacional 81, Departamento Patino, Ibarreta, Argentina"
41.70063628,33.71604915,27,"KastamonuInebolu yolu, Kure, Turkey"
52.42094478,59.0639369,2414,"ulitsa Mira, 22, Bogdanovskoe, Chelyabinsk Oblast, Russia, 457613"
-33.26276067,150.6654045,2415,"Putty Road, Colo Heights NSW 2756, Australia"
59.44861103,62.3447832,2416,"pgt Gari  d Koshmaki, Rychkova, Sverdlovsk Oblast, Russia"
65.03419802,26.44097482,2417,"Alavuotontie, Oulu, Finland"
-38.8951021,-61.61440456,2418,"Acceso a Balneario PehuenCo, Partido de Coronel de Marina Leonardo Rosales, Buenos Aires, Argentina"
-21.71318753,-57.66975252,2419,"Fazenda Fronteira, BR267, Porto Murtinho, Porto Murtinho  MS, Brazil"
63.00775701,112.467396,883,"ulitsa Kosmonavtov, Chernyshevsky, Sakha Republic, Russia, 678185"
-24.64975829,119.6058978,543,"Great Northern Highway, Kumarina WA, Australia"
-7.916955284,113.2246978,2420,"unnamed road, Lumajang, East Java, Indonesia"
-8.592946595,-69.81119422,530,"BR364, Feijo, Feijo  AC, Brazil"
-9.362716035,-45.47297023,2421,"BR235, Matas, Regiao Geografica Intermediaria de CorrenteBom Jesus  PI, Brazil"
-33.18608746,-66.58168938,2422,"RP15, Belgrano, San Luis, Argentina"
22.16359949,-99.10263865,2423,"unnamed road, 79280 Casas Viejas, SLP, Mexico"
-22.43494737,-43.43814115,2424,"unnamed road, Paty do Alferes  RJ, Brazil"
-33.73553584,-63.49271278,2425,"Ruta Provincial 4, Departamento Juarez Celman, Pacheco de Melo, Argentina"
55.42804699,-3.981939827,2426,"unnamed road, Sanquhar, DG4 6HD, United Kingdom"
-28.16263081,-51.67712706,2427,"Rodovia Waldemar Menon, Lagoa Vermelha, Lagoa Vermelha  RS, Brazil"
11.73698681,12.18757807,990,"KanoMaiduguri Highway, Gambir Moduri, Yobe, Nigeria"
47.67006427,20.36409299,2428,"3358 Erdotelek, 31, Hungary"
-34.3249294,-65.32759308,2429,"Autopista por la Paz del Mundo, General Pedernera, San Luis, Argentina"
-16.42245958,-71.08575829,2430,"AR119, San Juan de Tarucani, Peru"
-3.672280224,103.0581494,2431,"unnamed road, Ujung Alih, South Sumatra, Indonesia"
12.40857221,102.6459555,2432,"Dan Chumphon, 3271, Trat Province, Thailand"
-29.2202958,152.6042431,2433,"7161 Clarence Way, Baryulgil NSW 2460, Australia"
-33.80711823,-61.33805482,2434,"RN8, Departamento General Lopez, Hughes, Argentina"
-3.166796293,39.64802463,401,"C103, Adu ward, Kenya"
18.2433279,99.76300936,2435,"unnamed road, baansbpaad, Lampang Province, Thailand"
-29.80013899,-50.76200549,2436,"Estrada do Maracana, Glorinha, Regiao Geografica Intermediaria de Porto Alegre  RS, 94380000, Brazil"
-8.006578835,-39.78499541,2437,"BR316, Icaicara, Parnamirim  PE, Brazil"
-10.21470128,-44.61513982,2438,"PI255, Manguari, Parnagua  PI, Brazil"
13.70618822,99.73959444,2439,"unnamed road, Ratchaburi Province, Thailand"
-12.90086832,-56.44819546,2440,"unnamed road, Lucas do Rio Verde  MT, Brazil"
-31.43753966,-65.10443294,2441,"Ruta Provincial 15, Departamento San Alberto, Cordoba, Argentina"
-50.21529924,-72.99171397,1507,"Lago Argentino, Argentina"
-9.630782008,-42.62435971,2442,"BR235, Pocos, Remanso  BA, Brazil"
-31.90260946,-57.26672525,2443,"Ruta 26 Brigadier General Leandro Gomez 2790, 60000 El Eucaliptus, Uruguay"
-23.56680403,28.76511321,2444,"N11, Mogalakwena Ward 2, Mogalakwena Local Municipality, South Africa"
38.69723364,31.07144599,2445,"unnamed road, Bolvadin, Turkey"
38.09832845,14.74695553,2446,"SP155, 98070 Mirto ME, Italy"
16.30348582,79.93657647,2447,"Narketpally  Addanki  Medarametla Road, Palnadu, Vipparla, Andhra Pradesh, India"
-22.48482918,-48.9408693,2448,"Rodovia Marechal Rondon, Agudos, Agudos  SP, Brazil"
-35.98660151,-59.04867967,1246,"Ruta Nacional 3 Don Juan Manuel de Rosas, Partido de Las Flores, Buenos Aires, Argentina"
-40.40858828,-65.02816081,2449,"Ruta Provincial 2, Departamento Conesa, San Antonio Oeste, Argentina"
5.637286671,-0.620550528,2450,"IR1, Kwanyako, Ghana"
-1.833445063,37.535177,2451,"UkiaEmali Road, Makueni, Kenya"
-36.93081834,-69.79068017,2452,"Butaco, Ruta Nacional 40, Departamento Pehuenches, Municipio de Barrancas, Argentina"
-6.342428486,-49.79541793,736,"PA160, Canaa dos Carajas, Canaa dos Carajas  PA, Brazil"
-30.7282809,-53.21016653,2453,"BR392, Santana da Boa Vista, Regiao Geografica Intermediaria de Santa Maria  RS, Brazil"
-6.87601037,-35.02067317,2454,"PB033, Rio Tinto, Rio Tinto  PB, Brazil"
25.98958444,-100.2955202,2455,"Monterrey  Colombia, Salinas Victoria, NLE, Mexico"
28.93180965,-114.1610405,2456,"Carretera Lazaro CardenasPunta Prieta, 22970 Punta Prieta, BCN, Mexico"
9.208476354,5.724843561,241,"A124, Niger State, Nigeria"
63.02790635,112.4803854,2457,"Viliuiskaia GES, Sakha Republic, Russia, 678185"
-18.19697736,-45.21847114,2458,"unnamed road, Tres Marias, Regiao Geografica Intermediaria de Belo Horizonte  MG, 39205, Brazil"
-8.383991491,-70.20060615,530,"BR364, Feijo, Feijo  AC, Brazil"
-4.94202355,-42.33169725,2459,"BR343, Tamandua, Altos  PI, Brazil"
1.00062886,-76.56723453,2460,"A Puerto Limon, PUT, Colombia"
37.01529186,28.52393711,2461,"D400, Koycegiz, Turkey"
2.604983555,112.6089663,2462,"Jalan SibuBintulu, Sarawak, Malaysia"
-27.83710264,120.7184112,642,"LeinsterMine Road, Leinster WA, Australia"
-31.85858712,147.1473418,2463,"Tottenham Road, Nyngan NSW 2825, Australia"
12.98438572,105.1820706,99,"unnamed road, Cambodia"
-30.91230489,23.27472925,2464,"N12, Emthanjeni Ward 7, Emthanjeni Local Municipality, 8782, South Africa"
-40.97381304,-65.40066435,2465,"Ruta Nacional 3, Departamento San Antonio, Sierra Grande, Argentina"
50.39361692,103.8562224,2466,"unnamed road, Khamnei, Buryatia, Russia"
4.609842353,-60.24581204,2467,"Vicinal Flechal, Uiramuta, Uiramuta  RR, Brazil"
-30.51055255,135.345846,1235,"Stuart Highway, Bon Bon SA 5719, Australia"
-15.98595143,-56.91704874,2468,"MT451, Chumbo, Pocone  MT, Brazil"
-26.40093506,-52.60616789,2469,"unnamed road, Mariopolis, Regiao Geografica Intermediaria de Cascavel  PR, Brazil"
-35.02638295,-63.4064885,2470,"Ruta Nacional 188, Departamento Chapaleufu, 6244 Municipio de Bernardo Larroude, Argentina"
-13.40718776,-49.09004936,2471,"GO244, Estreito, Porangatu  GO, Brazil"
6.447015249,6.342963521,916,"unnamed road, Edo State, Nigeria"
59.60530716,65.90255515,2472,"Shkolnyi pereulok, 3V1, Mezhdurechenskiy, KhantyMansiysk Autonomous Okrug  Ugra, Russia"
-33.67050297,-55.99560039,1764,"Ficticia Valdez, Florida, Uruguay"
3.123574991,39.25203761,1310,"C80, Golobo ward, Kenya"
-21.37972002,27.39028182,2473,"unnamed road, ShasheSemotswane, Botswana"
68.44263193,24.0188027,2474,"Ounastie, Enontekio, Finland"
-31.00758339,144.4717007,2475,"Fifty Two Mile Road, Tilpa NSW, Australia"
63.25021103,129.4758899,2476,"Nam, Sakha Republic, Russia"
44.14220613,28.50663973,2477,"Autostrada Soarelui, 907300 Valu lui Traian, Romania"
57.38825837,63.7501205,2478,"Gorbunovskoe  Baikalovo  Irbit, Baikalovo, Sverdlovsk Oblast, Russia"
49.3063987,33.04233131,2479,"N08, Kremenchuk Raion, Kahamlyk, Poltava Oblast, 39043, Ukraine"
-24.89832188,133.1959687,1638,"Stuart Highway, Ghan NT, Australia"
7.159208032,126.1553141,2480,"unnamed road, Banaybanay, 8207 Davao Region Davao Oriental, Philippines"
12.60193184,5.877996118,2481,"A126, Danmanau, Zamfara State, Nigeria"
39.62240178,140.407036,2482,"National Highway Route 46, Daisen, Akita Prefecture, Japan"
66.25413416,20.34458785,2483,"Gullringheden, Murjeksvagen, Jokkmokks kommun, Sweden"
-3.208340297,-48.96829046,2484,"PA150PA475, Cairari, Moju  PA, Brazil"
-51.76636169,-71.74859159,2485,"Ea Santa Ana, Ruta Nacional 40, Guer Aike, Santa Cruz Province, Argentina"
0.459047718,101.9499025,2486,"unnamed road, Kota Pelalawan, Riau, Indonesia"
-7.092543184,-63.11111567,2487,"Manaus  Porto Velho, Humaita, Humaita  AM, Brazil"
-0.891813198,-80.40051116,2488,"E38, Rocafuerte, Ecuador"
-19.73718803,-48.55579894,2489,"unnamed road, Campo Florido, Regiao Geografica Intermediaria de Uberaba  MG, Brazil"
41.6513105,13.59564447,2490,"unnamed road, 03033 Arpino FR, Italy"
5.406627082,117.9524529,2491,"Jalan SandakanLahad Datu, 90200 Kg Mengaris, Sabah, Malaysia"
-39.91740093,-66.851405,2492,"Ruta Provincial 63, Departamento Nueve de Julio, Rio Negro Province, Argentina"
9.3167998,12.49451867,2493,"Njobbore, Girei, Nigeria"
-22.17016849,-50.70615508,2494,"unnamed road, Quata, Quata  SP, Brazil"
0.34455131,120.2393422,2495,"unnamed road, Central Sulawesi, Indonesia"
20.88694435,-98.89645231,2496,"HGO 37, Tlaxcantitla, HID, Mexico"
40.74150356,-0.400025448,2497,"Calle Baja, 44562 Castellote, Spain"
14.42789676,-3.325962046,261,"IreliDama, Bandiagara Cercle, Mali"
-48.67287678,-70.73351861,2498,"Ruta Provincial 29, Rio Chico, Santa Cruz Province, Argentina"
65.78097231,45.03256739,48,"11K502, Arkhangelsk Oblast, Russia"
0.439724353,35.4726728,2499,"unnamed road, Kaptagat ward, Kenya"
-40.45328613,-66.83630473,2500,"Ruta Nacional 23, Departamento Valcheta, Los Menucos, Argentina"
-31.72252303,-60.55203779,2501,"Lorenzo Anselmi, Bajada Grande, Parana, Argentina"
-23.95461746,119.7682031,930,"Great Northern Highway, Capricorn WA, Australia"
51.99629986,33.14514577,1362,"N27, NovhorodSiverskyi Raion, Loska, Chernihiv Oblast, 16071, Ukraine"
47.87510849,117.8838992,2502,"Buir Family Resort, Khalkhgol, Mongolia"
15.39707578,-15.21663406,2503,"N 3, Nguit, Senegal"
-30.73182901,144.8117642,2504,"Bourke Wilcannia Road, Louth NSW 2840, Australia"
7.610497846,-74.79726444,2505,"unnamed road, El Bagre, ANT, Colombia"
64.10021298,32.95217625,2506,"A137, Republic of Karelia, Russia"
13.31068287,-11.64525987,1062,"R061, Missirah Sirimana, Senegal"
15.03692523,76.2346106,2507,"Bandihalli Road, Vijayanagara, Bandihalli  583212, Karnataka, India"
-24.79270773,-60.45967448,2508,"Ruta Nacional 81, Departamento Patino, Las Lomitas, Argentina"
16.32413505,-16.04574897,2509,"TAH 1, Communaute rurale de Ronkh, Senegal"
63.36979142,28.30720313,2510,"Riitasalontie, Rautavaara, Finland"
-35.22927623,-69.6635354,2511,"Ruta Nacional 40, Departamento Malargue, Mendoza, Argentina"
-22.70861416,116.3850132,1861,"Nanutarra Road, Nanutarra WA, Australia"
-1.079353828,115.1020815,2512,"Jalan Poros Muara TewehAmpah, Sikui, Central Kalimantan, Indonesia"
66.59713396,21.27902858,2513,"BD 810, Gallivare kommun, Sweden"
46.91432727,22.01247623,2514,"unnamed road, 417277 Mierlau, Romania"
17.9918224,-92.31701624,2515,"Carretera Jonuta CiudadPemex, TAB, Mexico"
68.23737103,-52.84956014,2516,"unnamed road, Niaqornaarsuk, Greenland"
49.37966428,24.61071161,2517,"N09, IvanoFrankivsk Raion, Verbylivtsi, IvanoFrankivsk Oblast, 77037, Ukraine"
47.55372009,23.94230424,2518,"DC54, 437133 Ungureni, Romania"
-14.62899268,-42.69806307,2519,"BR122BA030, Urandi, Urandi  BA, Brazil"
-9.527263183,-54.86107188,2520,"BR163, Novo Progresso, Guaranta do Norte  MT, Brazil"
37.53331047,36.40803156,2521,"4651, Andirin, Turkey"
-18.14142706,-54.68663516,2522,"BR163, Coxim, Coxim  MS, Brazil"
-8.298810727,-35.85489183,2523,"Rodovia Luiz Gonzaga, Caruaru, Caruaru  PE, 55020497, Brazil"
5.048427231,-2.47783173,2524,"N1, Nvelenu, Ghana"
-23.95517306,23.89358554,2525,"A12, Tswaane, Botswana"
-16.6379356,134.8678864,749,"Carpentaria Highway, Pamayu NT, Australia"
-11.69700883,-76.57457718,2526,"Carretera Santa Eulalia  Milloc, Laraos, Peru"
-36.50513425,148.8855793,2527,"The Snowy River Way, Dalgety NSW 2628, Australia"
57.98303808,29.79364621,2528,"Pskovskaia doroga, Peski Orzhany, Pskov Oblast, Russia"
-34.5950994,-59.89805461,2529,"Acceso a Castilla, Partido de Carmen de Areco, Buenos Aires, Argentina"
-27.29658851,27.71699925,2530,"S163, Ngwathe Ward 18, Ngwathe Local Municipality, South Africa"
-8.817948185,-67.06636857,1689,"unnamed road, Labrea, Labrea  AM, Brazil"
-13.00800327,142.4791658,2531,"Peninsula Developmental Road, Archer River QLD, Australia"
36.3465892,30.43975071,2532,"unnamed road, 07370 Kumluca, Turkey"
-24.13193755,143.4774801,2533,"Tonkoro Ban Ban Road, Stonehenge QLD, Australia"
-13.2138356,-41.0699434,2534,"Avenida Iramaia, Itaete, Itaete  BA, Brazil"
13.57377771,78.77780922,2535,"Kalakada  Kalikiri  Somala Road, Chittoor, Utupalle, Andhra Pradesh, India"
-22.83033477,31.23382243,2536,"H17, Thulamela Ward 8, Thulamela Local Municipality, South Africa"
-21.51551173,-57.35408675,2537,"Fazenda Bom Despacho, unnamed road, Porto Murtinho, Porto Murtinho  MS, Brazil"
16.28962186,-0.044627024,700,"Tomb of Askia Unesco world heritage site, RN18, Gao, Mali"
-23.15618033,113.7677135,2538,"111 Monck Head Drive, Lyndon WA 6701, Australia"
-32.07679267,-54.69422211,2539,"Ruta 44 Coronel Fernando Otorgues, Tacuarembo, Uruguay"
5.028870311,-74.04150885,2540,"La Pradera  Zipaquira, Zipaquira, Colombia"
-3.781852177,-41.82391351,2541,"unnamed road, Sao Jose do Divino, Regiao Geografica Intermediaria de Parnaiba  PI, Brazil"
53.58468815,-1.021151936,2542,"The Sandwich Bar, 257 Station Road, Hatfield, DN7 4DY, United Kingdom"
14.65377863,98.55628046,2543,"baanaihmphathnaa, 3272, Kanchanaburi Province, Thailand"
-30.93533162,144.4150229,2544,"TilpaTonga Road, Tilpa NSW 2840, Australia"
58.0769665,57.76755141,2545,"Volkhovstroiskaia ulitsa, 71, Lysva, Perm Krai, Russia, 618906"
27.93905106,77.94713045,2546,"unnamed road, Aligarh, Akravat  202140, Uttar Pradesh, India"
-19.74189883,-42.17394826,2547,"Rua Sebastiao Silverio, Dom Modesto, Caratinga  MG, 35300, Brazil"
46.60576447,13.29087812,2548,"Nassfeld Strasse, 9631 HermagorPressegger See, Austria"
39.73363849,32.80870693,2549,"AnkaraAdana yolu, 06830 Golbasi, Turkey"
-9.041601505,-44.38411378,2550,"unnamed road, Bom Jesus  PI, 64900000, Brazil"
65.87583903,75.01565694,1646,"71140R1, YamaloNenets Autonomous Okrug, Russia"
-37.20253863,-63.43702442,2551,"unnamed road, Departamento Atreuco, 6306 Municipio de Rolon, Argentina"
27.0246566,-109.8508663,2552,"Calle 2700, SON, Mexico"
14.34490678,-89.78611659,2553,"Carretera Panamericana, Municipio de Jutiapa, Guatemala"
-23.90152054,151.2919266,2554,"LOT 6 Wapentake Road, South Trees QLD 4680, Australia"
