latitude,longitude,location,newlocation
54.07060824,73.53014868,4257,"Iavleno  Pokrovka  Belousovka  Iurevka, Belousovka, Omsk Oblast, Russia"
40.12056242,31.49393005,4258,"BeypazariNallihan yolu, 06920 Nallihan, Turkey"
16.38390587,-14.06307515,1367,"unnamed road, CasCas, Senegal"
53.24494374,-6.220530823,4259,"Cannons Corner, Ballyedmonduff Road, Ballyedmonduff, Stepaside, County Dublin, D18, Ireland"
-31.49813339,151.093705,4260,"Crawney Road, Nundle NSW 2340, Australia"
-43.93192514,-67.30496428,4261,"RP48, Departamento Martires, Chubut Province, Argentina"
46.94793861,19.48001309,4262,"6041 Kerekegyhaza, Papszek dulo, Hungary"
-10.81126549,-69.42170161,4263,"Estrada do Pacifico, Assis Brasil, Regiao Geografica Intermediaria de Rio Branco  AC, Brazil"
67.4321048,20.93542778,4264,"Nilimannikko, BD 833, Skaulo, Sweden"
-11.22798308,-40.25894138,4265,"unnamed road, Itapeipu, Jacobina  BA, Brazil"
24.67545856,81.6135078,4266,"NH135, Tlkuri, 486111, Madhya Pradesh, India"
-31.49389381,149.3592975,4267,"4819 Warrumbungles Way, Binnaway NSW 2395, Australia"
-16.28941331,133.6747001,4268,"Carpentaria Highway, Birdum NT, Australia"
-34.16693521,-62.48524492,4269,"Ruta Nacional 33 Ruta del Desierto Doctor Adolfo Alsina, Rufino, Argentina"
8.749394077,10.9274405,2355,"A4, Taraba State, Nigeria"
21.38638744,79.02935367,4270,"Dohanghat, Savner, India"
16.77205925,-3.006939635,3348,"unnamed road, Timbuktu, Mali"
50.62369197,107.8126612,4271,"81A004, Buryatia, Russia"
-23.75021471,139.6243389,202,"Diamantina Developmental Road, Amaroo QLD, Australia"
25.48761301,-107.92507,4272,"Calle Francisco I Madero, ALAMEDA, 80808 Mocorito, SIN, Mexico"
35.05956065,126.5522748,4273,"South Korea, South Jeolla, Masanri, donghampyeongsaneobdanji, unnamed road, 57145"
-2.247516944,111.667491,4274,"unnamed road, Rimba Jaya, Central Kalimantan, Indonesia"
-25.94271042,152.9475206,4275,"Tin Can Bay Road, Tin Can Bay QLD 4580, Australia"
30.27006588,-106.4848245,4276,"Santa Rita, Carretera Miguel AhumadaChihuahua, CHH, Mexico"
-43.71023914,-66.90260915,4277,"Ruta Nacional 25, Departamento Martires, Chubut Province, Argentina"
-33.21658891,144.5617685,4278,"Cobb Highway, Mossgiel NSW 2878, Australia"
37.66197604,42.31056309,4279,"Siirt  Sirnak yolu, Eruh, Turkey"
49.27817066,16.67497772,4280,"37445, 664 01 Bilovice nad Svitavou, Czechia"
42.63909161,74.49245707,4281,"Kyrgyzstan, Chuy Region, SK Stroitel, M010"
59.93562596,16.87473201,4282,"Skiljevagen 1, 744 31 Heby, Sweden"
-29.69913203,-65.58128904,4283,"Ruta Nacional 79, Departamento La Paz, Municipio de Recreo, Argentina"
18.0237588,78.91224552,4284,"Ragi Kunta, unnamed road, Siddipet, Darga  502277, Telangana, India"
-34.09481754,-65.35830144,2429,"Autopista por la Paz del Mundo, General Pedernera, San Luis, Argentina"
-13.49862867,-48.36386535,4285,"GO241, Cana Brava, Minacu  GO, Brazil"
-43.92727619,-70.32001242,4286,"Ruta Provincial 63, Departamento Tehuelches, Chubut Province, Argentina"
-12.66102873,141.9914414,431,"Peninsula Developmental Road, Mission River QLD, Australia"
-8.817948185,-67.06636857,1689,"unnamed road, Labrea, Labrea  AM, Brazil"
11.11433034,11.37540317,4287,"unnamed road, Ngalda, Yobe, Nigeria"
17.27469209,121.8846993,4288,"unnamed road, Antagan 2nd, Cagayan Valley Isabela, Philippines"
57.81633885,57.49528395,4289,"57K0001, Perm Krai, Russia, 618966"
-17.68768174,145.5089418,4290,"150 Arthur Baillie Road, Ravenshoe QLD 4888, Australia"
46.4455937,16.79281045,4291,"8866 Becsehely, 6836, Hungary"
-22.50363278,-51.92966585,4292,"Fazenda Sao Luis, Rodovia Sandovalina  Usina Taquarucu, Sandovalina, Regiao Geografica Intermediaria de Presidente Prudente  SP, Brazil"
-26.26453888,116.0662329,934,"Carnarvon Mullewa Road, Gascoyne River WA, Australia"
-28.56084939,152.5810819,4293,"Clarence Way, NSW, Australia"
-9.12926732,-35.3729747,4294,"AL460, Porto de Pedras, Regiao Geografica Intermediaria de Maceio  AL, Brazil"
-22.26241482,148.1787648,4295,"Saraji Road, Winchester QLD, Australia"
-23.85752403,23.67049752,581,"unnamed road, Botswana"
9.906342593,12.60981478,4296,"A13, Sigire Fulbe, Adamawa State, Nigeria"
38.58803822,30.24453319,4297,"Afyonkarahisar  Burdur Yolu, Sandikli, Turkey"
49.790536,95.00576992,344,"Baruunturuun, Mongolia"
1.430668177,-78.27319739,374,"10, Tumaco, NAR, Colombia"
54.52604021,17.93636385,4298,"unnamed road, 84218 Jezewo, Poland"
27.0955766,75.44320582,4299,"unnamed road, JaipurRural, Karansar  303609, Rajasthan, India"
39.31895227,29.98533122,4300,"D240, Kutahya Merkez, Turkey"
-33.40494083,19.90278,4301,"N1, Breede Valley Local Municipality, South Africa"
61.17241869,21.74971661,4302,"Lapintie, Eurajoki, Finland"
-40.56873457,-67.71687161,4303,"Ruta Nacional 23, Departamento Nueve de Julio, Los Menucos, Argentina"
48.59043415,18.71644385,4304,"2495, 966 04 Prochot, Slovakia"
49.84421869,20.49770167,4305,"unnamed road, 32725 Lipnica Gorna, Poland"
-19.10007549,-43.15671337,4306,"MG232, Carmesia, Regiao Geografica Intermediaria de Belo Horizonte  MG, Brazil"
58.09130909,65.23020639,4307,"ulitsa Papanintsev, Piatidvorka, Tavda, Sverdlovsk Oblast, Russia"
-32.55590306,148.0249658,4308,"Sharkeys Lane, Tomingley NSW 2869, Australia"
48.25268973,110.0256189,4309,"Bereeven khiid  Binder, Bereeven khiid, Mongolia"
23.30829147,-106.279857,4310,"SIN 506, Progreso, Miravalles, SIN, Mexico"
-25.06950789,143.73076,1429,"Yaraka Retreat Road, Jundah QLD, Australia"
-8.526998638,-38.14000199,1977,"PE360, Airi, Floresta  PE, Brazil"
-3.48914149,-51.17977482,501,"TransAmazonian Highway, Anapu, Anapu  PA, Brazil"
49.9250058,27.0867853,4311,"N25, Khmelnytskyi Raion, Penky, Khmelnytskyi Oblast, 31110, Ukraine"
52.15958223,60.3341843,4312,"ulitsa Sevostianova, 29, Naslednitskii, Chelyabinsk Oblast, Russia"
-8.397944616,-48.11856513,4313,"Avenida Tocantins, Tupiratins, Regiao Geografica Intermediaria de Araguaina  TO, 77743000, Brazil"
57.12915659,101.3799207,4314,"Bratsk  UstIlimsk, Irkutsk Oblast, Russia"
-28.21837472,114.9480959,4315,"BallaWhelarra Road, Yuna WA, Australia"
64.75169843,24.63084755,4316,"Siikajoentie, Raahe, Finland"
-10.00934688,-77.89364137,4317,"Carretera Huarmey  Recuay, Huarmey, Peru"
-1.630791539,-48.31861169,4318,"unnamed road, GuajaraMiri, Acara  PA, Brazil"
10.50405181,-73.0670584,4319,"unnamed road, La Jagua del Pilar, LAG, Colombia"
52.39109756,-1.175918852,4320,"Station Road, Lilbourne, CV23 0TF, United Kingdom"
54.08954504,15.47517956,4321,"102, 78133 Boguslawiec, Poland"
44.4739599,9.319501968,4322,"Ventarola, Rezzoaglio Genoa, Italy"
-38.70635111,-60.22578877,4323,"Ruta Provincial 72, Partido de Tres Arroyos, Lin Calel, Argentina"
44.91273689,22.35906211,4324,"DN6, 327270 Mehadia, Romania"
-27.27584585,27.65166033,2530,"S163, Ngwathe Ward 18, Ngwathe Local Municipality, South Africa"
-20.05710985,-45.16247233,4325,"unnamed road, Santo Antonio do Monte  MG, Brazil"
53.10412466,19.30301782,4326,"unnamed road, 87522 Gulbiny, Poland"
12.5462839,-16.30005854,4327,"unnamed road, 27000 Bainouk, Senegal"
14.22369042,-91.67763458,4328,"Carretera Cuyotenango  Tulate, Tulate, Guatemala"
-27.5981181,-61.93876023,1617,"Ruta Nacional 89, General Capdevila, Quimili, Argentina"
51.69787421,21.85405724,4329,"unnamed road, Babice, Poland"
-32.6651804,-66.45379187,4330,"RP45, Belgrano, Villa General Roca, Argentina"
65.0106108,20.24255545,4331,"Nyback, Jornsvagen, Skelleftea kommun, Sweden"
38.87614705,36.47029163,4332,"Pinarbasi  Sarkisla Yolu, 38700 Pinarbasi, Turkey"
-50.52788919,-70.80470156,4333,"Ruta Provincial 2, Lago Argentino, Santa Cruz Province, Argentina"
13.1629655,-12.93087803,4334,"N 7, Dar Salam, Senegal"
63.98657066,54.52257643,1792,"87R001, Komi Republic, Russia"
-22.89356603,144.6221183,3388,"Crossmoor Road, Muttaburra QLD, Australia"
26.09502868,-100.1585768,4335,"Quiroga, unnamed road, NLE, Mexico"
41.57869787,33.77905946,4336,"KastamonuInebolu yolu, Devrekani, Turkey"
58.92169043,80.11953106,3310,"Kargasok  Middle Vasyugan, Tomsk Oblast, Russia"
6.141378397,124.8366252,4337,"unnamed road, TBoli, Soccsksargen South Cotabato, Philippines"
-35.52363122,-62.28118755,2576,"Ruta Nacional 226, Partido de Carlos Tejedor, Buenos Aires, Argentina"
-40.680018,-69.11741976,3685,"Ruta Provincial 6, Departamento Veinticinco de Mayo, Rio Negro Province, Argentina"
-38.25530507,147.1374263,4338,"1003 Seaspray Road, Longford VIC 3851, Australia"
-36.85557012,-67.43892638,4339,"Ruta Nacional 151, Departamento Puelen, Municipio de Puelen, Argentina"
31.26900068,-107.822603,3742,"Carretera AscensionCiudad Juarez, CHH, Mexico"
45.88937929,21.96927809,4340,"DJ609, 307051 Cladova, Romania"
15.67041793,104.3697849,4341,"Ban Don Khueang, unnamed road, Yasothon Province, Thailand"
-24.52122486,-59.41038643,4342,"Ruta Nacional 86, Departamento Patino, Fortin Sargento Primero Leyes, Argentina"
-30.4143093,-66.86718656,4343,"Bajo del Gallo, Ruta Provincial 27, Departamento General Angel V Penaloza, La Rioja, Argentina"
-19.30315382,144.3592085,4344,"Lyndhurst Station, Kennedy Developmental Road, Lyndhurst QLD, Australia"
-26.48371506,147.7047362,4345,"Warrego Highway, Womalilla QLD, Australia"
-43.43019215,-67.68696421,3127,"Ruta Provincial 40, Departamento Martires, Chubut Province, Argentina"
-14.3919086,-53.00244114,2866,"unnamed road, Campinapolis  MT, Brazil"
-25.20651329,150.2262083,4346,"Eidsvold Theodore Road, Cracow QLD, Australia"
0.977235066,112.9160048,2829,"Jalan Lintas Utara, Putussibau Utara, West Kalimantan, Indonesia"
66.70480455,66.15460894,4347,"unnamed road, Labytnangi, YamaloNenets Autonomous Okrug, Russia"
45.91787,113.5333978,107,"unnamed road, Mongolia"
-31.43371095,22.5738143,1071,"R63, Ubuntu Ward 3, Ubuntu Local Municipality, 6985, South Africa"
-33.60179197,120.2163948,4348,"South Coast Highway, Ravensthorpe WA, Australia"
-28.08701606,148.5549148,4349,"Whyenbah Road, St George QLD, Australia"
10.61600427,7.228736167,4350,"unnamed road, Kunai, Kaduna State, Nigeria"
0.244170113,37.96512961,4351,"unnamed road, Meru County, Kenya"
16.6692803,-93.55855642,4352,"Autopista Arriaga  Tuxtla Gutierrez, Vicente Guerrero, CHP, Mexico"
45.66122376,15.71336,4353,"unnamed road, 10452 Donji Desinec, Croatia"
53.46154271,22.02020283,4354,"unnamed road, 18505 Lachowo, Poland"
-15.36897441,-44.44516457,4355,"LMG603, Olhos DAgua do Bom Jesus, Regiao Geografica Intermediaria de Montes Claros  MG, Brazil"
-32.08167553,-61.56987436,4356,"Ruta Nacional 34, Departamento San Martin, Municipio de Canada Rosquin, Argentina"
16.219372,102.7894459,4357,"Ban Wang Wa, unnamed road, Khon Kaen Province, Thailand"
-20.04388099,141.6429479,4358,"Taldora Road, Taldora QLD, Australia"
9.70196421,-73.27441732,4359,"Calle 9, Becerril, CES, Colombia"
-11.47036758,-51.6812435,4360,"BR158MT158, Sao Felix do Araguaia  MT, Brazil"
-6.658558745,-38.81914991,4361,"Rodovia Santos Dumont, Umari, Regiao Geografica Intermediaria de Iguatu  CE, Brazil"
54.08624129,41.41696085,4362,"Ural, Ryazan Oblast, Russia, 391555"
-19.69548322,22.01800125,2144,"6201, Nokaneng, Botswana"
-7.992475749,-71.37839876,825,"BR364, Tarauaca, Tarauaca  AC, Brazil"
-12.21164218,-42.80144374,4363,"Rodovia Milton Santos, Oliveira dos Brejinhos, Oliveira dos Brejinhos  BA, Brazil"
-13.54003142,-75.2088181,4364,"Via de los Libertadores, Huaytara, Peru"
-19.34360657,135.1808318,1125,"Barkly Highway, Warumungu NT, Australia"
0.859992426,39.24900286,3149,"IsioloMandera Road, Mado Gashi, Kenya"
66.71180847,25.70299013,411,"Rovaniemi, Lapland, Finland"
-6.726623567,-55.47961473,1054,"BR163, Novo Progresso, Novo Progresso  PA, Brazil"
30.70338979,75.82892579,4365,"unnamed road, Ludhiana, 141204, Punjab, India"
-15.52381898,-39.85560172,4366,"BR251, Itapetinga, Itapetinga  BA, Brazil"
63.58076271,29.33230404,4367,"Alavantie, Nurmes, Finland"
-33.14517454,119.0314691,4368,"NewdegatePingrup Road, Mallee Hill WA, Australia"
-34.02601754,141.1204112,4369,"Nampoo Station, Rufus River Road, Rufus NSW 2648, Australia"
51.82872815,-3.61144245,4370,"Pant Mawr, A4067, Powys, LD3 8YY, United Kingdom"
49.07512612,20.28027413,4371,"D1, 058 01 Poprad, Slovakia"
-10.89942536,-62.24130688,4372,"RO473, Teixeiropolis, Regiao Geografica Intermediaria de JiParana  RO, Brazil"
53.67356534,-6.741582836,4373,"R147, County Meath, C15, Ireland"
-35.47961097,-63.17516949,4374,"Ruta Provincial 70, Partido de Rivadavia, Buenos Aires, Argentina"
14.67285504,79.55954804,4375,"NH67, Sri Potti Sriramulu Nellore, Chiruvellakhandrika  524322, Andhra Pradesh, India"
-50.79445338,-69.51448096,4376,"Ruta Nacional 3, Guer Aike, Santa Cruz Province, Argentina"
-16.60488713,133.3611175,1052,"Stuart Highway, Birdum NT, Australia"
17.95582855,103.538285,4377,"Sakon Nakhon Province, Thailand"
-38.83441036,-66.43052595,4378,"Ruta Nacional 232, Departamento Avellaneda, Rio Negro Province, Argentina"
-21.59991232,143.480979,4379,"Kennedy Developmental Road, Stamford QLD, Australia"
-27.94777474,-62.14324069,4380,"Las Tres Lomas, RP116, Departamento Juan Felipe Ibarra, Quimili, Argentina"
-31.56545901,-66.23578011,317,"Ruta Nacional 79, Departamento General San Martin, Ulapes, Argentina"
41.70955181,19.97544273,4381,"unnamed road, 4606Kthelle, Albania"
-30.93407347,119.4994085,4382,"Koolyanobbing  Southern Cross Road, Turkey Hill WA, Australia"
20.85054826,83.86686709,4383,"NH57, Subarnapur, Subarnapur  767017, Odisha, India"
-24.21233068,148.1709391,4384,"LOT 44 Dawson Highway, Cairdbeign QLD 4722, Australia"
50.59121077,20.74813779,4385,"73, 26020 Sladkow Maly, Poland"
13.678284,123.440129,4386,"unnamed road, 4422 Bicol Region Camarines Sur, Philippines"
-5.006597114,-38.3886355,4387,"Rodovia Francisco Andrade Teofilo Girao, Morada Nova  CE, Brazil"
-25.62647504,148.7163808,4388,"Old Fairview Road, Beilba QLD, Australia"
1.628379747,101.0209389,4389,"Jalan Lintas Bagan SiapiApi, Bangko Bakti, Riau, Indonesia"
-8.591739934,-63.99500254,2170,"Manaus  Porto Velho, Acuanopolis, Canutama  AM, Brazil"
-5.87972765,-62.39067587,697,"Manaus  Porto Velho, Tapaua, Tapaua  AM, Brazil"
48.03051327,16.35488204,4390,"L2085, 2353 Guntramsdorf, Austria"
28.28138794,-107.4857784,4391,"Carretera San PedroCreelGuachochi, CHH, Mexico"
-26.76837476,-66.80940717,4392,"Cuesta de Randolfo, Departamento Belen, Municipio de Villa Vil, Argentina"
-33.98679677,136.3065651,4393,"1298 Wharminda Boundary Road, Verran SA 5603, Australia"
61.31371613,31.85387442,4394,"86K255, Lunkulansaari, Republic of Karelia, Russia"
40.359022,-2.960659697,4395,"unnamed road, Yebra, Spain"
39.44862566,33.34688213,4396,"Kirikkale  Konya Yolu, 06720 Bala, Turkey"
-25.94208257,152.9839168,4397,"LOT 36 Tin Can Bay Road, Tin Can Bay QLD 4580, Australia"
40.98285109,25.74237846,4398,"Kirke  Sukorrakhe, Kirki, Greece"
-30.48536702,-57.13303635,4399,"Ruta 30 3216, 55000 Artigas, Uruguay"
12.64626002,8.407767176,252,"kano  Daura Road, Kanti, Jigawa State, Nigeria"
-29.83813603,-52.39577965,4400,"Rodovia Hainsi Gralow, Sede Municipal, Santa Cruz do Sul  RS, 96860900, Brazil"
-33.8665639,117.8427443,4401,"120 Graham Road, Broomehill East WA 6318, Australia"
18.73611713,101.0045194,4402,"Ban Khwaeng, unnamed road, Mae Charim District, Nan Province 55170, Thailand"
-16.99295092,125.2047511,4403,"King Leopold Ranges WA 6728, Australia"
-16.05417297,-39.15202276,4404,"BA275, Mogiquicaba, Belmonte  BA, Brazil"
16.95595559,121.4053271,4405,"IfugaoIsabela Road, Aguinaldo, Cordillera Administrative Region Ifugao, Philippines"
0.743974131,113.1660368,4406,"unnamed road, West Kalimantan, Indonesia"
-12.32066897,-55.32210412,4407,"MT140MT225, Vera  MT, Brazil"
39.8774895,-2.796221406,4408,"unnamed road, 16431 Saelices, Spain"
9.325407353,5.241849246,438,"A124, Kudu, Niger State, Nigeria"
-23.54166413,28.71507758,2444,"N11, Mogalakwena Ward 2, Mogalakwena Local Municipality, South Africa"
-24.92113194,26.18697796,4409,"Ramotshere Moiloa Ward 19, Ramotshere Moiloa Local Municipality, 2869, South Africa"
-32.99997009,144.8824096,4410,"Trida Road, Ivanhoe NSW 2878, Australia"
-23.0009449,-66.35653855,4411,"Aguas Termales, Ruta Nacional 40, Departamento Susques, Coranzuli, Argentina"
-21.28848035,116.1515103,377,"North West Coastal Highway, Mardie WA, Australia"
59.3849166,126.9995303,754,"Lena, Sakha Republic, Russia"
-33.835448,139.3122374,4412,"Goyder Highway, Bundey SA 5320, Australia"
65.50345234,28.91870006,4413,"Viitostie, Taivalkoski, Finland"
41.63966399,21.8515427,4414,"A1, Grnchishte, North Macedonia"
-22.21104417,-56.77042394,183,"unnamed road, Bela Vista, Bela Vista  MS, Brazil"
25.55682615,56.18307157,4415,"Al Shohadaa Road, Zahir As Safwah, Fujairah Emirate, United Arab Emirates"
37.46220044,42.72560587,1938,"SirnakHakkari yolu, Uludere, Turkey"
-16.14840683,-40.59069793,4416,"Rodovia Joel Mares, Bairro Cidade Nova, Almenara  MG, Brazil"
-23.63611,26.53611439,738,"A1, Dibete Station, Botswana"
-3.689769981,-53.59194581,3356,"TransAmazonian Highway, Uruara, Uruara  PA, 68140, Brazil"
-32.20805064,151.0409103,4417,"1875 Sandy Creek Road, Mccullys Gap NSW 2333, Australia"
56.3703774,15.55268249,4418,"Navragolsvagen, Navragol, Sweden"
-26.32706871,133.1941073,2014,"Stuart Highway, Ayers Range South SA 0872, Australia"
-34.61603505,-62.97938352,1867,"La Josefa, Ruta Nacional 33 Ruta del Desierto Doctor Adolfo Alsina, Partido de General Villegas, Buenos Aires, Argentina"
-24.26595748,143.5537716,4419,"Yaraka Bimerah Road, Stonehenge QLD, Australia"
59.62569187,41.17606137,4420,"A123, Zapole, Vologda Oblast, Russia"
-16.23081048,-71.81928465,4421,"AR539, Yura, Peru"
-12.24369682,-61.15797341,4422,"Chupinguaia, Regiao Geografica Intermediaria de JiParana, Brazil"
0.554936571,39.26898028,4015,"GarissaModogashe Road, Garissa, Kenya"
-33.09552316,26.23970512,3715,"R350, Makana Ward 1, Makana Local Municipality, South Africa"
-30.12113613,116.0587148,1680,"Midlands Road, Gunyidi WA, Australia"
20.37840631,-99.86902682,4423,"El Sitio  Limite Estados, 76830 El Sitio, QUE, Mexico"
-33.22866378,-61.34637953,4424,"Ruta Nacional 33 Ruta del Desierto Doctor Adolfo Alsina, Departamento Caseros, Municipio de Chabas, Argentina"
62.68425333,124.5409102,517,"Vilyuisky Trakt, OrtoSurt, Sakha Republic, Russia"
-7.496691388,-36.04553867,4425,"PB132, Barra de Santana, Regiao Geografica Intermediaria de Campina Grande  PB, 58458, Brazil"
0.78033327,-60.1026717,4426,"Rodovia Afranio Bittencourt, Sao Luiz, Regiao Geografica Intermediaria de RorainopolisCaracarai  RR, Brazil"
-24.48017298,25.23757377,4427,"unnamed road, Kotolaname, Botswana"
-22.05814167,-49.32271253,4428,"PSA430, Guaricanga, Regiao Geografica Intermediaria de Bauru  SP, Brazil"
39.4591378,22.494386,4429,"unnamed road, Nikea, Greece"
-19.46209853,-65.78791653,885,"unnamed road, Potosi, Bolivia"
63.25021103,129.4758899,2476,"Nam, Sakha Republic, Russia"
-39.16406015,-65.00735753,4430,"Ruta Nacional 22 Ceferino Namuncura, Departamento Pichi Mahuida, Rio Negro Province, Argentina"
37.10646539,41.09000137,4431,"MardinSirnak yolu, Nusaybin, Turkey"
-32.6823071,-57.99759682,4432,"Ruta 24 Guyunusa, 61100 Gartental, Uruguay"
50.65313123,106.0496339,4433,"Lkhundub Dechinling, Kamennyi Kliuch  Belooziorsk  Dzhida, Dyrestuy, Buryatia, Russia"
66.66706906,22.83889568,4434,"Alsjarvssvedjan, 392, Overkalix kommun, Sweden"
23.11393971,-109.7447115,4435,"Libramiento Aeropuerto, 23429 San Jose del Cabo, BCS, Mexico"
-39.9065644,-69.91361238,4436,"Ruta Nacional 237, Departamento Collon Cura, Neuquen Province, Argentina"
47.37139733,34.96979021,4437,"R37, Vasylivka Raion, Balky, Zaporizhia Oblast, 71635, Ukraine"
6.020349315,0.003135363,4438,"R40, Somanya, Ghana"
-36.34594777,143.8318713,4439,"282 Colemans Lane, Kinypanial VIC 3520, Australia"
-27.9093028,27.82272842,4440,"James van Huysteen Street, Moqhaka Ward 2, Moqhaka Local Municipality, South Africa"
58.38877477,59.83065666,4441,"65K5304000, Borovaia, Sverdlovsk Oblast, Russia, 624320"
0.970671997,-52.17519984,901,"BR210, Pedra Branca do Amapari, Pedra Branca do Amapari  AP, Brazil"
-22.1348387,-51.93097426,4442,"Rodovia Euclides de Oliveira Figueiredo, Maraba Paulista, Regiao Geografica Intermediaria de Presidente Prudente  SP, 19430, Brazil"
-39.86446686,-64.4382951,4443,"Ruta Nacional 251, Departamento Pichi Mahuida, Rio Negro Province, Argentina"
-20.57098147,-54.55152264,4444,"MS040, Campo Grande, Campo Grande  MS, 79065000, Brazil"
-17.38863731,-42.63071723,3981,"MG308, Turmalina  MG, Brazil"
51.89444391,19.74132335,4445,"unnamed road, 95061 Lubowidza, Poland"
0.996687958,-51.09640258,4446,"BR156, Ferreira Gomes, Regiao Geografica Intermediaria de OiapoquePorto Grande  AP, Brazil"
2.287418088,-59.8382175,371,"Estrada Jacamim, Bonfim, Bonfim  RR, Brazil"
11.27014424,10.58303051,4447,"KanoMaiduguri Highway, Sade West, Bauchi State, Nigeria"
-9.749364251,-51.01882932,2024,"BR158, Santana do Araguaia, Araguaia River  PA, Brazil"
-22.46281504,144.4893633,1608,"Hughenden Muttaburra Road, Muttaburra QLD, Australia"
-9.976961618,-55.25412083,4448,"MT419, Novo Mundo, Regiao Geografica Intermediaria de Sinop  MT, Brazil"
-23.97328468,-52.55748872,4449,"Rua Oito, Sao Geraldo, Araruna  PR, Brazil"
61.91055311,27.7770428,4450,"Pieksamaentie, Juva, Finland"
-3.127085689,-51.59933761,501,"TransAmazonian Highway, Anapu, Anapu  PA, Brazil"
-20.13952059,-49.92775152,4451,"Rodovia Pericles Bellini, Cardoso, Cardoso  SP, Brazil"
-11.33274102,-44.94603728,4452,"BR135, Caripare, Santa Rita de Cassia  BA, Brazil"
-36.22380878,148.799568,4453,"Middlingbank Road, NSW, Australia"
-33.46306273,-60.03732245,4454,"Camino Ingeniero Agronomo Jorge Horacio Salazar, Partido de Ramallo, 2915 Ramallo, Argentina"
-49.44747082,-69.71037599,3138,"Ruta Provincial 27, Corpen Aike, Santa Cruz Province, Argentina"
51.11405415,20.6333856,4455,"unnamed road, 26220 Swierczow, Poland"
25.20797107,-103.419884,4456,"Noria de la Trinidad, Carretera Juan EugenioFlor de JimulcoSan Juan de Guadalupe, La Flor de Jimulco, Coahuila, Mexico"
-26.37328384,-51.20685884,4457,"unnamed road, Xaxim Jangada, Porto Uniao  SC, Brazil"
-21.35864865,146.5352425,161,"Gregory Developmental Road, Llanarth QLD, Australia"
37.70388121,27.20446882,4458,"Milli Park Yolu, Kusadasi, Turkey"
49.93655743,19.43143576,4459,"Wadowicka 62, 34108 Przybradz, Poland"
-26.5811918,118.5016513,379,"Great Northern Highway, Meekatharra WA, Australia"
-36.73010508,-59.77884811,4460,"Ruta Nacional 3 Don Juan Manuel de Rosas, Partido de Azul, Buenos Aires, Argentina"
-35.71101414,-58.56512734,4461,"El Siasgo, Ruta Provincial 41 Gobernador Manuel Dorrego, Partido de Monte, Buenos Aires, Argentina"
1.122674818,-77.60722555,4462,"unnamed road, Tuquerres, NAR, Colombia"
-31.68901721,137.2001176,4463,"LOT 1157 Stuart Highway, Oakden Hills SA 5713, Australia"
12.14636416,76.66309202,4464,"unnamed road, Mysuru, Katvadipura  571300, Karnataka, India"
66.84661369,56.63983529,1792,"87R001, Komi Republic, Russia"
-38.53651347,-61.38126131,4465,"Ruta Provincial 72, Partido de Coronel Dorrego, Buenos Aires, Argentina"
-36.93868749,-70.91651353,4466,"Las Ovejas  Epu Lauquen, Departamento Minas, Municipio de Las Ovejas, Argentina"
-20.92994952,119.8301925,4467,"Marble Bar Road, Marble Bar WA, Australia"
35.17020737,25.10505931,4468,"Erakleio  Iera Mone Epanosephe, Temenos Municipal Unit, Greece"
6.870420241,6.671933973,4469,"unnamed road, Irahun, Kogi State, Nigeria"
-16.58658353,-69.22224534,4470,"Carretera Binacional, Sicuyani, Peru"
-31.96349371,-57.85278675,4471,"Ruta 3 General Jose Gervasio Artigas, Paysandu, Uruguay"
-17.59285699,-61.99819626,1199,"RN4 ParaisoSan Jose de Chiquitos, Municipio Pailon, Bolivia"
-45.45196293,-69.64229436,4472,"Ruta Nacional 26, Departamento Rio Senguer, Chubut Province, Argentina"
46.64298336,23.84671405,4473,"DJ161B, 407465 Ploscos, Romania"
68.59739202,21.73764173,4474,"Kasivarrentie, Enontekio, Finland"
-30.48748932,-64.67910001,4475,"Ruta Provincial 16, Departamento Ischilin, Chuna, Argentina"
38.7965781,38.7423594,1748,"ElazigKeban yolu, Keban, Turkey"
-34.99420125,-69.41806077,4476,"Ruta Nacional 40, Departamento San Rafael, Mendoza, Argentina"
-29.14666089,23.70592253,4477,"R357, Siyancuma Ward 6, Siyancuma Local Municipality, South Africa"
-22.27345039,137.8323377,352,"Plenty Highway, Anatye NT, Australia"
-32.15738532,117.9227445,4478,"ShackletonBilbarin Road, Babakin WA, Australia"
38.53487671,30.89570349,4479,"0327, Cay, Turkey"
-25.36048688,22.95671111,1990,"A20, Makopong, Botswana"
46.79720019,27.2406261,4480,"DC123, 737053 Babusa, Romania"
-3.179437127,39.88270088,4481,"C103, Jilore ward, Kenya"
-8.779006366,-67.12484499,4482,"unnamed road, Boca do Acre, Boca do Acre  AM, Brazil"
47.58622226,19.37540317,4483,"2100 Godollo, Ipolysag utca, Hungary"
-26.5148036,-58.78246919,4484,"Ruta Provincial 9, Departamento Laishi, Villa Escolar, Argentina"
39.62686976,35.23700226,4485,"YozgatKayseri yolu, Sorgun, Turkey"
3.763493318,-61.75620069,1268,"Mirante do Paiva, Estrada do Paiva, Amajari, Amajari  RR, Brazil"
4.661732545,115.8579398,4486,"unnamed road, ALUTOK, Sabah, Malaysia"
14.19107636,-12.70920542,4487,"N 1, 34206 Goudiry, Senegal"
-7.722531936,-37.8421456,4488,"Vila Coab, Quixaba, Regiao Geografica Intermediaria de Serra Talhada  PE, 56828, Brazil"
55.98227584,26.99560013,4489,"Bancani, V636, Udrisu pagasts, Latvia"
-15.9658683,136.299271,4490,"Bing Bong, Mcarthur NT, Australia"
50.84390405,99.32367672,4491,"unnamed road, UlaanUul, Mongolia"
5.123372311,-1.605063936,4492,"N1, Badukrom, Ghana"
55.00102386,-4.527209102,4493,"unnamed road, Dumfries and Galloway, DG8 6RD, United Kingdom"
49.53777741,114.2846713,4494,"Bayandun  Dashbalbar, Dashbalbar, Mongolia"
35.11069201,135.7603148,4495,"kamikurodakibune line, Sakyo Ward, Kyoto, Kyoto Prefecture 6038821, Japan"
