latitude,longitude,location,newlocation
17.73803934,103.1464901,5866,"Ban Wang Khang Hung, d4014, Udon Thani Province, Thailand"
16.52068361,-15.3246269,4033,"N 2, Bokhol, Senegal"
39.9007949,33.70321039,5867,"KirikkaleYozgat yolu, 71520 Balisih, Turkey"
48.5674178,25.21513053,5868,"R24, Pidgaichiki, Hvizdets Settlement Hromada, IvanoFrankivsk Oblast, 78264, Ukraine"
-19.82598409,120.9427695,477,"Great Northern Highway, Eighty Mile Beach WA, Australia"
-27.49609431,-65.60697903,5869,"Ruta Nacional 38 Primera Variante, Barrio Santa Rita, Tucuman, Argentina"
40.11577221,36.85811883,694,"unnamed road, Yildizeli, Turkey"
-34.80113522,-66.28069592,5422,"RP12, Juan Martin de Pueyrredon, Navia, Argentina"
22.18898184,-104.6754185,5870,"Ruiz  Zacatecas, 63546 Mesa de Nayar, NAY, Mexico"
48.38849655,15.01581556,5871,"L82, Barnkopf, Austria"
-6.240915195,-80.38215933,2577,"Carretera Panamericana Norte, Olmos, Peru"
-21.90876216,-52.49527037,5872,"MS395, Bataguassu, Bataguassu  MS, Brazil"
-18.94995319,-49.76265716,5873,"Rodovia BR365, Ituiutaba  MG, Brazil"
-33.41977472,121.7113888,5874,"Darkel Farms, Coolgardie Esperance Highway, Scaddan WA, Australia"
14.03329394,-13.66038216,5875,"N 7, Lama, Senegal"
45.847903,93.08052546,107,"unnamed road, Mongolia"
14.13474906,106.411739,5876,"unnamed road, Siem Pang, Cambodia"
48.44594265,16.72514585,5877,"L18, 2223 Spannberg, Austria"
-17.57863863,133.5802829,196,"Stuart Highway, Pamayu NT, Australia"
-2.463324262,-45.79703239,5878,"BR316, Tres Irmaos, Santa Luzia do Parua  MA, Brazil"
-23.11203455,117.8628468,5879,"Paraburdoo  Tom Price Road, Rocklea WA, Australia"
40.2167605,141.0620316,5880,"unnamed road, Ninohe, Iwate Prefecture 0390314, Japan"
52.16696825,109.4816642,5881,"81R002, Udinsk, Buryatia, Russia"
-22.26201297,-45.65887592,5882,"Fazenda de Jose Pinho Ribeiro, unnamed road, Santa Rita do Sapucai  MG, Brazil"
-30.48086511,30.15608687,5883,"unnamed road, Umzumbe Ward 2, Umzumbe Local Municipality, South Africa"
11.21520952,-73.33525586,5884,"Via Santa Marta, Dibulla, LAG, Colombia"
6.612786217,80.2251808,5885,"Bulathsinhala  Galketiya  Molkawa Road, Molkawa, Sri Lanka"
-11.10106629,-42.9680929,5886,"BA160, Copixaba, XiqueXique  BA, Brazil"
6.486612241,8.736464032,5887,"A4, Nwang, Cross River State, Nigeria"
-22.72398148,-47.67603693,5888,"Avenida dos Marins, Glebas California, Piracicaba  SP, 13403130, Brazil"
12.82632591,-15.20594328,5889,"N12, Velingra Boido, Senegal"
-22.42921349,-53.24131995,5890,"Fazenda Bom Jesus I, MS134, Bataypora, Bataypora  MS, Brazil"
47.36818432,26.1371258,5891,"DJ155A, 727466 Buda, Romania"
-24.40663563,25.59349428,5892,"Molepolole Road, Botswana"
40.50574718,16.44844042,5893,"Via Antonio De Curtis, 75013 Ferrandina MT, Italy"
-33.68025656,-65.43822225,5894,"Maipu, Almirante Brown, Villa Mercedes, Argentina"
12.60236513,8.351628529,5895,"unnamed road, Amaryawa, Jigawa State, Nigeria"
8.454925282,81.06696009,5896,"unnamed road, Mollipothana 31312, Sri Lanka"
38.99673835,38.49792965,5897,"D260, Arapgir, Turkey"
-3.758674189,-54.82347396,5898,"Rodovia Santarem  Cuiaba, Placas, Placas  PA, Brazil"
-13.31989366,132.7805111,5899,"Kakadu, Twin Falls, Northern Territory, Australia"
-8.641162499,-77.87580125,5900,"PE12A, Yanac, Peru"
25.27193652,-99.73558715,5901,"unnamed road, La Purisima, NLE, Mexico"
2.678723171,-60.49737883,5902,"unnamed road, Canta, Canta  RR, Brazil"
-30.42493884,25.63786693,5903,"N1, Kopanong Ward 5, Kopanong Local Municipality, South Africa"
-31.42234689,-57.51698963,5904,"Vecinal a Ruta 4, Salto, Uruguay"
-32.08532393,117.6430265,5905,"Old Beverley East Road, Wamenusking WA, Australia"
6.892515103,2.997831002,365,"unnamed road, Ilaro, Nigeria"
10.3928151,-2.072484473,5906,"R181, Daffiama Bussie Issa District, Ghana"
-33.30946848,134.8669145,5907,"20546 Flinders Highway, Talia SA 5670, Australia"
54.32542661,-6.847218939,5908,"Cortynan Road, Tynan, BT68 4UF, United Kingdom"
-11.52653864,-54.85968284,5909,"Avenida Joaquim Murtinho, Claudia, Regiao Geografica Intermediaria de Sinop  MT, 78540000, Brazil"
13.60987194,105.8575939,5910,"unnamed road, Stung Treng, Cambodia"
30.06721928,-115.3574272,3624,"Carretera Transpeninsular, BCN, Mexico"
-43.05199616,-70.94469066,5911,"Ruta Provincial 62, Departamento Futaleufu, Chubut Province, Argentina"
-17.71880826,-53.91743164,5912,"MS215, Pedro Gomes, Regiao Geografica Intermediaria de Campo Grande  MS, Brazil"
-23.13866984,119.3113793,432,"Great Northern Highway, Newman WA, Australia"
-5.019945273,-46.08763182,5913,"MA006, Calumbi, Arame  MA, Brazil"
-26.82525439,146.0819204,5914,"Mitchell Highway, Bakers Bend QLD, Australia"
-51.09299525,-70.59226335,2600,"Gobernador Mayer, Ruta Provincial 5, Guer Aike, Santa Cruz Province, Argentina"
45.28311996,24.81030725,5915,"unnamed road, 117287 Jgheaburi, Romania"
46.10750776,27.16017344,5916,"DN11A, 607659 Adjud, Romania"
48.01262183,46.09777153,5917,"Kaspii, Chorny Yar, Astrakhan Oblast, Russia, 416231"
1.889574056,39.82549891,5918,"WajirMoyale Road, Wagalla, Kenya"
47.52119836,40.57395883,5919,"Shakhty  Razdorskaia, Pukhlyakovskiy, Rostov Oblast, Russia, 346561"
-30.56854043,-64.00303384,1175,"Ruta Nacional 9, Departamento Totoral, Las Penas, Argentina"
64.08060194,54.66678221,3175,"87R001, Malaia Pera, Komi Republic, Russia, 169540"
49.83583891,106.4428125,5920,"Dulaankhaan  Eroo, Mongolia"
15.83540136,101.6420905,2175,"unnamed road, Chaiyaphum Province, Thailand"
-24.51346409,113.9794119,5921,"North West Coastal Highway, Yandoo Creek WA, Australia"
15.7516617,102.5455087,5922,"Ban Nong Makhuea, 2246, Khon Kaen Province, Thailand"
48.16232006,19.24125086,5923,"2605, 991 25 Nenince, Slovakia"
56.98674468,38.07540383,5924,"Sergiev Posad  Kaliazin  Rybinsk  Cherepovets, Tver Oblast, Russia"
-22.1042572,-55.04205017,5925,"MS162, Carumbe, Itapora  MS, Brazil"
34.97318866,137.4425045,5926,"unnamed road, Zuo Shou Ya keGu, Shinshiro, Aichi Prefecture 4411423, Japan"
14.95151615,-12.58129845,4164,"N 2, Bondji Bokar, Senegal"
-15.31238671,-70.22900852,5927,"Carretera Longitudinal de la Sierra Sur, Calapuja, Peru"
24.90060301,-103.2401884,5928,"unnamed road, Oriente Aguanaval, DUR, Mexico"
-28.88066812,152.57079,1376,"1522 Tabulam Road, Tabulam NSW 2469, Australia"
11.74710751,10.15367525,5623,"unnamed road, Magwanshi, Bauchi State, Nigeria"
-5.148913708,-41.68790338,5929,"PI216, Juazeiro do Piaui, Regiao Geografica Intermediaria de Teresina  PI, 64343000, Brazil"
59.3610899,11.8386418,2130,"Bastnas, S 500, Arjangs kommun, Sweden"
6.423756989,80.22942896,5930,"unnamed road, Pelawaththa, Sri Lanka"
-7.738993661,-72.69512957,5931,"BR364, Rodrigues Alves, Rodrigues Alves  AC, 69985000, Brazil"
-13.81159077,48.48818713,5932,"Bemaneviky, Diana Region, Madagascar"
-8.446698951,-45.76617835,5933,"BR330MA006, Tasso Fragoso, Regiao Geografica Intermediaria de Imperatriz  MA, Brazil"
-38.48818954,-66.33379232,479,"Ruta Nacional 232, Departamento Curaco, Comision de Fomento de Gobernador Duval, Argentina"
-27.61497855,-60.72345489,5934,"RP18, Departamento Mayor Luis Jorge Fontana, 3540 Villa Angela, Argentina"
3.324024567,-73.53996633,5935,"unnamed road, Granada, MET, Colombia"
11.59738663,99.50059156,5936,"Bang Saphan District, Prachuap Khiri Khan Province 77140, Thailand"
-29.35450782,115.0129699,5937,"Cousins, Brand Highway, Mount Adams WA, Australia"
41.5914544,12.80166433,5938,"Via Campoleone, 04012 Cisterna di Latina LT, Italy"
-33.28879804,144.5748336,4278,"Cobb Highway, Mossgiel NSW 2878, Australia"
51.16585836,58.62662119,367,"unnamed road, Staraia Biofabrika, Orsk, Orenburg Oblast, Russia"
36.58765342,35.38412637,5939,"Kadoil, AdanaKaratas yolu, 01900 Karatas, Turkey"
12.90507996,-11.7601809,1062,"R061, Missirah Sirimana, Senegal"
11.46574421,10.34101313,5940,"Misau  Azare Road, Dunkurmi, Bauchi State, Nigeria"
-39.08741337,-66.51024124,2918,"Ruta Nacional 22 Ceferino Namuncura, Departamento Avellaneda, Rio Negro Province, Argentina"
7.9397814,80.7309428,906,"InamaluwaSigiriya Road, Sigiriya 21121, Sri Lanka"
-2.383664353,-44.58985367,5941,"MA106, Rio Grande, Alcantara  MA, Brazil"
-28.37766785,152.5813653,5942,"122 Mount Lindesay Road, Woodenbong NSW 2476, Australia"
-23.63470038,146.4675296,5943,"LOT 302 Capricorn Highway, Alpha QLD 4724, Australia"
6.539839923,-71.34445101,5944,"66, Tame, ARA, Colombia"
-24.65687026,139.564793,1319,"Eyre Developmental Road, Bedourie QLD, Australia"
-18.46753934,-52.23894173,5945,"unnamed road, Serranopolis, Regiao Geografica Intermediaria de Rio Verde  GO, Brazil"
-15.92746352,-51.3173133,5946,"BR070, Marechal Rondon, Jussara  GO, Brazil"
-33.05077587,141.6671392,5947,"Coombah, Silver City Highway, Broken Hill NSW, Australia"
-23.44411476,-46.07390445,5948,"unnamed road, Guararema, Guararema  SP, 08850170, Brazil"
11.72856118,10.16423722,2847,"Magwanshi, Katagum, Nigeria"
18.2146416,77.21746124,5949,"NH50, Bidar, Diggi, Karnataka, India"
-16.90012059,-48.55288385,5950,"GO139 Estrada Sao Miguel do Passa Quatro, Vianopolis  GO, Brazil"
-20.16781019,-40.42709643,5951,"Rodovia Paulo Nascimento, Posto Fiscal de Cariacica, Santa Leopoldina  ES, Brazil"
-20.30550803,141.673792,594,"Bauhinia Downs, Taldora Road, Taldora QLD, Australia"
42.58700745,27.11859395,5952,"Trakia Motorway, Vratitsa 8109, Bulgaria"
60.49347279,14.58423137,5953,"Vansbro kommun, Dalarna County, Sweden"
40.77770112,41.50845004,5954,"Yusufeli, Artvin, Turkey"
48.69797232,43.82521474,5955,"A260, Volgograd Oblast, Russia, 404523"
-37.3460617,-58.82879233,5956,"Ruta Provincial 74 Gobernador Mariano Acosta, Partido de Tandil, Buenos Aires, Argentina"
-18.83464066,25.60157179,1260,"A33, Botswana"
59.3610899,11.8386418,2130,"Bastnas, S 500, Arjangs kommun, Sweden"
7.943842145,9.782129918,5957,"Takum  Bukuru Federal Road, Wukari, Taraba State, Nigeria"
-0.867387806,-60.51411493,50,"Rodovia Manaus  Boa Vista, Presidente Figueiredo, Presidente Figueiredo  AM, Brazil"
42.5957588,76.77078929,5958,"Kyrgyzstan, IssykKul Region, Choktal, EM09"
-16.62494298,-45.21651683,5959,"Rodovia MG161, Remanso do Fogo, Regiao Geografica Intermediaria de Montes Claros  MG, Brazil"
-16.25390718,-57.46034403,5960,"BR070, Sadia, Caceres  MT, Brazil"
-6.963234131,110.4110313,5961,"Jalan Taman Hasanudin, Semarang Utara, Semarang 50178, Central Java, Indonesia"
-23.71464012,145.2900926,5962,"The Patrick, Landsborough Highway, Barcaldine QLD, Australia"
18.12257031,-89.12187309,5963,"Carretera Laguna OmTomas Garrido, Dos Aguadas, ROO, Mexico"
-33.47320035,144.7134532,991,"Cobb Highway, Booligal NSW 2711, Australia"
-19.55070737,-41.20464878,5964,"BR474, Conceicao do Capim, Aimores  MG, Brazil"
64.92903271,15.66406331,5965,"unnamed road, Vilhelmina kommun, Sweden"
7.896565445,10.64968604,5208,"A12, Kungana, Taraba State, Nigeria"
46.43407347,15.74019307,5966,"711, 2206 Brunsvik, Slovenia"
27.48814309,-114.2641106,5967,"Ramal a Bahia de Tortugas, BCS, Mexico"
46.59386345,93.55665955,5968,"Sutai khairkhany zam, Mongolia"
-11.4856619,-74.89029932,5969,"PE24A, Pampa Hermosa, Peru"
-28.62697411,25.60972342,5970,"Boshof Road, Tokologo Ward 1, Tokologo Local Municipality, South Africa"
0.406541126,-51.74349093,3531,"unnamed road, Mazagao, Mazagao  AP, Brazil"
-16.55544788,143.6348996,5971,"Burke Developmental Road, Gamboola QLD, Australia"
-27.48555262,149.7665282,5972,"Silent Grove, MeandarraTalwood Road, Meandarra QLD, Australia"
17.88135473,97.96577347,5973,"105, Sop Moei, Mae Hong Son Province, Thailand"
19.16082258,72.94517398,5974,"Rosewood, 3, MulundGoregaon Link Road, Nahur, Mumbai  400078, Maharashtra, India"
18.82376187,-99.93151697,5975,"Carr Sultepec Amatepec, El Puerto del Teamate Puerto de las Majadas, El Puerto del Teamate Puerto de las Majadas, MEX, Mexico"
48.68170667,101.8876725,5976,"ErdenemandalKhairkhan, Khairkhan, Mongolia"
14.11327691,99.60869576,5977,"Ban Rang Khop, unnamed road, Kanchanaburi Province, Thailand"
5.778686702,115.9967397,5978,"unnamed road, 89600, Sabah, Malaysia"
-18.99126549,139.9874669,2245,"Wills Developmental Road, Four Ways QLD, Australia"
6.75258981,80.12097146,5979,"Handapangoda  Horana Road, Poruwadanda, Sri Lanka"
53.46669925,-9.125181511,2241,"unnamed road, County Galway, Ireland"
54.0582666,33.1067218,5980,"A130, Smolensk Oblast, Russia"
19.63672216,-88.06362022,5981,"MEX 295, San Antonio Nuevo, ROO, Mexico"
18.82401677,-97.0057333,5982,"Avenida Revolucion del Estado de Mexico, Campo Grande, Campo Grande, VER, Mexico"
5.35646124,102.8804309,5983,"unnamed road, 21500 Tong River, Terengganu, Malaysia"
-3.186165846,-54.78487374,4877,"unnamed road, Mojui dos Campos, Mojui dos Campos  PA, Brazil"
27.27139637,72.29286922,5984,"unnamed road, Phalodi, Rajasthan, India"
-2.448590642,-54.09920041,5985,"Rua do campo, Pacoval, Prainha  PA, Brazil"
46.44502177,108.3434127,5986,"Choir  Nalaikh, Choir, Mongolia"
-31.74966421,-57.63595569,4625,"Departamental a Cuchilla San Jose, Paysandu, Uruguay"
47.45481543,104.5787095,1740,"A0301, Erdenesant, Mongolia"
1.424619388,-76.48791639,2308,"Via Mocoa  Pitalito, Santa Rosa, CAU, Colombia"
-24.55485607,24.72819245,5987,"Jwaneng Diamond Mine Road, Jwaneng, Botswana"
-4.735011739,-49.65518518,5988,"TransAmazonian Highway, Novo Repartimento, Novo Repartimento  PA, Brazil"
42.34099244,0.918394707,5989,"Eix Pirinenc, 25555 Sarroca de Bellera, Spain"
64.42553802,144.0222399,386,"Kolyma Highway, Sakha Republic, Russia"
17.84879031,103.2861551,5990,"Ban Na Mon, 2230, Nong Khai Province, Thailand"
68.67538779,21.59826172,4474,"Kasivarrentie, Enontekio, Finland"
63.04320752,123.9773121,855,"Vilyuisky Trakt, Sakha Republic, Russia"
2.657888575,99.70067323,5991,"unnamed road, Alang Bombon, North Sumatra, Indonesia"
-26.70847448,143.1765917,5992,"Cooper Developmental Road, Eromanga QLD, Australia"
-18.56988137,-44.46635181,5993,"BR135, Tomas Gonzaga, Curvelo  MG, Brazil"
-13.37401587,142.8812725,2531,"Peninsula Developmental Road, Archer River QLD, Australia"
4.95668064,-73.58661858,5994,"unnamed road, Almeidas, Colombia"
-19.02289308,-57.49981648,5995,"Pousada Pontal, Porto Taruma, Rua Frei Liberato Ketterer, Ladario, Ladario  MS, Brazil"
-36.48914318,148.6617224,5996,"7562 The Snowy River Way, Jindabyne NSW 2627, Australia"
-37.32098832,-58.76834892,5956,"Ruta Provincial 74 Gobernador Mariano Acosta, Partido de Tandil, Buenos Aires, Argentina"
12.54463598,107.4915966,5997,"Pech Chreada, Pech Chreada District, Cambodia"
46.43114897,24.27270484,5998,"Autostrada Transilvania, 545101 Iernut, Romania"
-36.05682211,140.8759435,5999,"2734 Red Bluff Road, Senior SA 5268, Australia"
47.03870717,9.943641882,6000,"Unterschrofenweg, 6791 Sankt Gallenkirch, Austria"
47.11621115,22.51502483,6001,"DC132, 417553 Valea Tarnei, Romania"
-20.62965523,141.1406849,1240,"Flinders Highway, Julia Creek QLD, Australia"
-23.16590468,27.52749131,6002,"B141, Ngwapa, Botswana"
-6.311283472,-41.507849,6003,"PI120, UnhadeGato, Pimenteiras  PI, Brazil"
-23.07737867,21.94029164,581,"unnamed road, Botswana"
-33.17953187,-65.8235052,6004,"Autopista El Saladillo, Coronel Pringles, Saladillo, Argentina"
23.30137034,82.6199447,6005,"NH43, Koriya, Patna, Chhattisgarh, India"
-11.10006997,-62.42793179,6006,"RO010, Urupa, Urupa  RO, Brazil"
-25.77066193,-50.33940288,6007,"Rodovia Prefeito Joao Batista Distefano, Sao Mateus do Sul  PR, Brazil"
-22.13596305,20.99160424,1285,"TransKalahari Corridor, Botswana"
-34.43030092,-55.13168962,6008,"unnamed road, Lavalleja, Uruguay"
38.4281145,33.95591869,6009,"Ankara  Adana Yolu, Aksaray, Turkey"
-28.85047912,16.67603011,6010,"Holgat, R382, Richtersveld Ward 2, Richtersveld Local Municipality, South Africa"
45.96133035,24.56398059,6011,"DJ106, 555101 Barghis, Romania"
-8.077890859,-63.60692571,6012,"BR319, Porto Velho, Porto Velho  RO, Brazil"
-9.829008874,-39.47790892,6013,"unnamed road, Uaua  BA, 48950, Brazil"
-32.13709317,140.7205081,6014,"Tepco Station, Barrier Highway, Bindarrah SA 5440, Australia"
60.1048798,14.20653088,6015,"S 847, Filipstads kommun, Sweden"
18.9742779,-88.01403151,3258,"Carretera CafetalMahahual, ROO, Mexico"
-48.74565731,-70.20889641,1345,"La Peninsula, Ruta Provincial 25, Rio Chico, Santa Cruz Province, Argentina"
-20.44654065,-45.56015021,6016,"Rua Luis Candido de Faria, Corrego Fundo, Regiao Geografica Intermediaria de Divinopolis  MG, Brazil"
-26.09469492,-62.15661005,801,"Ruta Nacional 16, Departamento Copo, Monte Quemado, Argentina"
-23.91366816,-51.84732968,6017,"Rodovia Prefeito Aloisio Alves Pereira, Sao Pedro do Ivai, Regiao Geografica Intermediaria de Londrina  PR, Brazil"
-18.32377359,-46.00836609,6018,"BR365, Galena, Presidente Olegario  MG, Brazil"
43.76611336,23.35226004,6019,"133, kv Mladenovo, Bulgaria"
16.64730816,-95.25678654,558,"unnamed road, OAX, Mexico"
45.6151107,113.6431668,72,"Dariganga  Baruun Urt, BaruunUrt, Mongolia"
-8.105124664,-36.63970423,6020,"unnamed road, Santa Maria, Regiao Geografica Intermediaria de Campina Grande  PB, Brazil"
-27.0177767,-54.63778836,6021,"Ruta Nacional 14, Departamento Cainguas, Municipio de Dos de Mayo, Argentina"
63.60544876,119.459627,6022,"Vilyuisky Trakt, Edei, Sakha Republic, Russia"
49.24247153,113.377316,6023,"Bayandun  Dashbalbar, Bayandun, Mongolia"
-10.69487838,-68.14468184,3521,"Estrada do Pacifico, Xapuri, Xapuri  AC, Brazil"
-23.63056495,-49.88436938,6024,"unnamed road, Siqueira Campos  PR, Brazil"
-36.44351287,-63.5284749,6025,"Ruta Nacional 5, Departamento Catrilo, Municipio de Catrilo, Argentina"
-34.78169723,-66.17723494,3424,"Ruta Provincial 3, Juan Martin de Pueyrredon, San Luis, Argentina"
20.72301349,-103.0685159,6026,"unnamed road, 45443 Region Centro, JAL, Mexico"
25.83220622,-97.39179649,6027,"Carretera MatamorosPlaya Bagdad, El Longoreno, TAM, Mexico"
-27.68243153,-67.0525601,6028,"Ruta Nacional 40, Departamento Belen, Catamarca, Argentina"
66.64507667,21.31634415,6029,"Solberget, BD 810, Nattavaara by, Sweden"
-3.635429333,-53.44531671,3264,"TransAmazonian Highway, Alvorada, Uruara  PA, Brazil"
53.10070633,84.71779351,6030,"Chuiskii trakt, Nalobikha, Altai Krai, Russia, 659830"
46.45128624,-0.182257897,6031,"Le Colombier, 79400 Exireuil, France"
-49.21476676,-71.9466537,6032,"Ruta Provincial 31, Lago Argentino, Santa Cruz Province, Argentina"
57.90384907,25.75816028,6033,"Andreni, Ergeme  Igaunijas robeza, LV4711, Latvia"
56.85688735,105.7146852,6034,"unnamed road, Tekhuchilishche, UstKut, Irkutsk Oblast, Russia"
-14.06961338,131.2504909,3172,"Oolloo Road, Douglasdaly NT, Australia"
-19.21455905,-50.14718111,6035,"Estrada Municipal 498, Chaveslandia, Santa Vitoria  MG, Brazil"
41.39852883,-1.230935616,6036,"Calle Arrabal Bajo, 50461 Carinena, Spain"
-31.45729956,149.9743065,6037,"6805 Coonabarabran Road, Premer NSW 2381, Australia"
-24.92504456,144.0291316,1429,"Yaraka Retreat Road, Jundah QLD, Australia"
-16.5365879,-50.54624143,6038,"GO060, Sao Luis de Montes Belos  GO, Brazil"
11.55152095,8.305452059,6039,"KanoZaria Highway, Ranka, Kano State, Nigeria"
-17.24016886,-45.85238058,6040,"MG408, Canabrava, Joao Pinheiro  MG, Brazil"
-8.739740713,-49.37469863,6041,"TO239, Taruma, Regiao Geografica Intermediaria de Palmas  TO, Brazil"
29.86394729,35.0357229,6042,"HaArava, Hevel Eilot Regional Council, Israel"
24.76418385,-99.69876299,6043,"El Colmillo, Carretera IturbideLinares, Las Crucitas, NLE, Mexico"
-28.7932117,-61.55385109,6044,"Ruta Nacional 95, Departamento 9 de Julio, Municipio de Villa Minetti, Argentina"
-21.54486356,-56.58945615,6045,"BR267, Jardim, Jardim  MS, Brazil"
-32.1101339,21.58431218,6046,"R353, Karoo Hoogland Ward 3, Karoo Hoogland Local Municipality, 6960, South Africa"
-13.81246387,131.8134227,6047,"10840 Stuart Highway, Pine Creek NT 0847, Australia"
-6.909985747,-48.04300847,6048,"BR153, Ponta do Asfalto, Wanderlandia  TO, Brazil"
26.80324952,-105.1348634,587,"unnamed road, Iturralde, CHH, Mexico"
-39.90173369,-69.32657849,5061,"Ruta Provincial 73, Departamento El Cuy, Municipio de Cipolletti, Argentina"
-9.009997267,-78.52763638,6049,"unnamed road, Chimbote, Peru"
56.93231241,75.74461171,994,"unnamed road, Keizes, Omsk Oblast, Russia"
-8.817948185,-67.06636857,1689,"unnamed road, Labrea, Labrea  AM, Brazil"
56.56750929,23.02712393,6050,"Veldres, Dobele  Ile  Auce, Iles pagasts, LV3716, Latvia"
29.64779129,-106.5747425,6051,"Supercarretera Ricardo Flores MagonOjo Laguna, CHH, Mexico"
53.81263456,60.80297868,6052,"75K361, Chesma, Chelyabinsk Oblast, Russia"
-31.18029428,141.6541352,589,"Silver City Highway, Fowlers Gap NSW 2880, Australia"
19.90842347,-98.37026802,6053,"Cuautepec  San Lorenzo Sayula  E C El Ocote  Apan, Cuautepec de Hinojosa, HID, Mexico"
20.03559413,-98.31307396,6054,"20 de Noviembre, 43740 Cuautepec de Hinojosa, HID, Mexico"
-13.7399528,-46.15359529,6055,"Fazenda Sagarana, Rodovia Presidente Juscelino Kubitschek, Correntina  BA, Brazil"
30.64346268,-111.0428552,6056,"Carretera TubutamaMagdalena, SON, Mexico"
42.57776415,25.72713415,6057,"SZR1023, Elhovo, Bulgaria"
-37.77824187,145.3015779,6058,"51 Bambra Street, Croydon VIC 3136, Australia"
-14.88208202,-47.76891621,6059,"GO237, Agua Fria de Goias, Regiao Geografica Intermediaria de LuzianiaAguas Lindas de Goias  GO, Brazil"
41.48162246,1.683866318,6060,"la Freixeneda, BV2304, 08718 Mediona, Spain"
-33.39186497,134.8997702,6061,"19589 Flinders Highway, Colton SA 5670, Australia"
-47.57429444,-71.62210203,6062,"Ruta Provincial 39, Rio Chico, Santa Cruz Province, Argentina"
-21.29111012,25.08660846,340,"B300, Botswana"
-23.06545246,-46.74220737,6063,"unnamed road, Jarinu, Jarinu  SP, 13240, Brazil"
-35.36665498,-60.71001828,6064,"Ruta Nacional 5, Partido de Nueve de Julio, Buenos Aires, Argentina"
37.08969373,35.69349419,6065,"unnamed road, Ceyhan, Turkey"
-28.33062138,116.944659,6066,"LOT 47 Geraldtonmount Magnet Road, Yalgoo WA 6635, Australia"
-37.65926501,-67.42416969,6067,"Ruta Provincial 20, Departamento Puelen, Municipio de 25 de Mayo, Argentina"
-26.88288972,143.3059532,2864,"unnamed road, Eromanga QLD, Australia"
-9.93566281,-56.94002409,97,"MT208, Nova Monte Verde, Regiao Geografica Intermediaria de Sinop  MT, Brazil"
55.74336806,59.5936998,6068,"unnamed road, Bozovo, Chelyabinsk Oblast, Russia"
58.11431144,102.6974773,1698,"Nevon  Keul, Nevon, Irkutsk Oblast, Russia"
-3.145375228,-54.78105283,6069,"Mojui dos Campos, Regiao Geografica Intermediaria de Santarem, Brazil"
52.10833717,48.3509753,6070,"63K00631, Solyanskiy, Saratov Oblast, Russia, 413703"
8.382125465,99.76151107,6071,"Ban Khao Khiew, Nakhon Si Thammarat Province, Thailand"
47.95948574,30.91040139,6072,"R75, Pervomaisk Raion, Pervomaisk, Mykolaiv Oblast, 55209, Ukraine"
-35.71255398,-66.35492378,6073,"Ruta Provincial 47, Gobernador Dupuy, Martin de Loyola, Argentina"
47.64131622,26.38388441,6074,"DJ290, 727479 Varatec, Romania"
-31.42781732,-59.49539106,6075,"Ruta Nacional 127, Departamento La Paz, Entre Rios Province, Argentina"
-7.988178104,-36.58033917,6076,"Estrada para Jatauba, Jundia, Jatauba  PE, Brazil"
-34.51232446,-63.81246165,6077,"Ruta Provincial 27, Departamento Presidente Roque Saenz Pena, San Joaquin, Argentina"
-52.89064511,-68.44591092,6078,"unnamed road, Departamento Rio Grande, Tierra del Fuego Province, Argentina"
40.38554237,36.03086605,6079,"Civril Yolu, 60300 Turhal, Turkey"
68.0520229,24.48485565,1031,"Ounasjoentie, Kittila, Finland"
63.25021103,129.4758899,2476,"Nam, Sakha Republic, Russia"
-28.1614883,145.037304,2937,"Bulloo Developmental Road, Eulo QLD, Australia"
-28.06775095,-64.67794276,6080,"Los Cerrillos, Ruta Nacional 64, Departamento Guasayan, Santiago del Estero, Argentina"
11.38220666,10.73485453,3634,"KanoMaiduguri Highway, Lamba, Bauchi State, Nigeria"
-26.52976941,113.9903232,6081,"Useless Loop Road, Nanga WA, Australia"
36.30343827,-6.069620194,6082,"unnamed road, 11140 Conil de la Frontera, Spain"
3.935063729,-72.10529358,6083,"Rubiales  Puerto Gaitan, Puerto Gaitan, MET, Colombia"
-24.60812399,-53.62251752,6084,"Rodovia Deputado Moacir Micheletto, Bragantina, Assis Chateaubriand  PR, Brazil"
-12.11982072,-76.65982155,6085,"LM119, Cieneguilla, Antioquia, Peru"
-22.31521431,114.0760727,2162,"MinilyaExmouth Road, Exmouth Gulf WA, Australia"
-29.42218543,27.87901883,6086,"A3, Ha Sempe, Lesotho"
-37.29958019,-69.89022566,6087,"Ruta Nacional 40, Departamento Pehuenches, Municipio de Buta Ranquil, Argentina"
-25.71200733,140.9741686,1654,"Birdsville Developmental Road, Tanbar QLD, Australia"
-6.117635091,-39.60225045,6088,"unnamed road, Acopiara  CE, Brazil"
52.29402713,56.26126501,6089,"Chebenki  Troitskoe, Ivanovka, Orenburg Oblast, Russia"
1.081534851,111.2757681,6090,"Jalan Sri AmanSerian, Entulang Jalai, Sarawak, Malaysia"
-13.3535568,-42.27714259,3447,"BA152, Caturama, Regiao Geografica Intermediaria de Vitoria da Conquista  BA, 46575000, Brazil"
-5.608682869,-36.57307981,6091,"RN263, Angicos, Angicos  RN, Brazil"
-20.92645221,-46.39781287,6092,"MG446, Petunia, Alpinopolis  MG, Brazil"
-44.49742318,-71.30711601,6093,"Reten Rio Cisnes, Estancia El Canoa, Camino Paso Appeleg Km 90, Lago Verde, Chile"
-40.76324663,-68.19900868,6094,"Ruta Provincial 8 Carlos Ernesto Soria, Departamento Veinticinco de Mayo, Los Menucos, Argentina"
43.31007013,23.36540874,6095,"1, Kravoder 3491, Bulgaria"
-24.9693549,143.9231258,1429,"Yaraka Retreat Road, Jundah QLD, Australia"
-18.23013646,-47.4466086,6096,"unnamed road, Abadia dos Dourados, Regiao Geografica Intermediaria de Uberlandia  MG, Brazil"
-18.47074725,-43.65065041,6097,"Fazenda Tuboes, BR259MGC259, Datas, Regiao Geografica Intermediaria de Teofilo Otoni  MG, Brazil"
-3.660315067,-49.07594659,6098,"PA150PA475, Goianesia do Para, Goianesia do Para  PA, Brazil"
